Rating,Review_Date,Review
6.0,2 June 2017,"I have neither been a fan of nor seen an entire episode of Baywatch. My limited exposure to the series was covering a weekend shift at work when it was still airing. And I am pretty sure every time that happened it was the same episode each time. Yet, I never did see the whole thing. So, when I first heard they were doing a movie based on the series, my knee jerk reaction was to snort and give it a hard pass. Then I saw that it was starring Dwayne ""The Rock"" Johnson and saw a trailer and I said, ""Okay, now I have to see it!"".

So, where to even begin on this one?

WARNING: If you are lactose intolerant or suffer from dairy sensitivity, avoid, I repeat, AVOID this film at all costs. Content within contains extremely high levels of cheesiness. 5 times more that recommended USDA allowances.

Baywatch should also be avoided if you take life too seriously, have chronic uptightness, and are woefully lacking a sense of humor or appreciation for complete ridiculousness.

That being said, I confess Baywatch is an awful movie. Absolutely terrible. The plot is thin, the acting amateurish, the characters two dimensional, and with few exceptions the dialogue forgettable. In good conscious I cannot recommend seeing this film at all let alone in the theater except under the following condition. Baywatch is primo Mystery Science Theater 3000 fodder and should be approached accordingly. Even better if done so as a group.

You can neither take this film seriously nor should you try. You will find yourself crackin' on this bad boy and as a result, against all rhyme, reason, and self-respect enjoying yourself. This is one of those it's so bad it's good, train wreck of a film that while horrifying to watch, you can't tear your eyes away and secretly find entertaining.

At the end of the day, if you're looking for a good, quality film, let the sun set on Baywatch and see something else. If, however, you're up for complete, over the top, tripe and a guilty pleasure, brave the breakers, slather on the sunscreen, hit the beach and movie theater and check out Baywatch. It's awful. But, it's an awful 6."
1.0,1 October 2018,"Just incredibly bad. I give it two stars for the two chuckles it got from me. One of which was a female character trying to look cool walking into a palm frond. In comparison, it makes the dumb original TV show seem like it should have won all the Emmys. All of them."
6.0,30 May 2017,"This film has had so many bad reviews and I honestly don't have a clue why. I went to see this film yesterday with my mates and we absolutely loved it! It had so much to offer, funny and entertaining from beginning to end. The acting was fantastic and the actors in this really know how to keep you entertained.

The film was hilarious, action packed, very sexy and the story line was brilliantly planned out. The way you have to follow the character of Matt Brody played by Zac Efron is great and makes you want to stay and see what happens. At the end of the day these bad reviews and scores this film is getting really confuses me, this is the best film I have seen in such a long time and I can't wait for Baywatch 2!"
4.0,16 June 2017,"Baywatch is a good movie with a reasonably well developed plot and a fantastic comedic cast. It is a very fun movie that had me laughing throughout. As you know, it is based on the show of the same name and, similarly to 21 Jump Street, it turns the concept of the television series on its head, making it a raunchy comedy. The chemistry between the cast members makes this film, I enjoyed each individual relationship, particularly Dwayne Johnson and Zac Efron, who have a big brother, little brother dynamic for the entire movie. Efron and Alexandra Daddario also had a very sweet connection with one another, as well as Kelly Rohrbach and Jon Bass, who had a dynamic that never failed to make me laugh.

I did not, however, appreciate the moments when this movie got too serious. There is an entire sequence when they go to save a burning boat, which I get was to showcase the seriousness of their situation, but it was fifteen minutes of no laughs, no comedy. It was all way too dramatic, and it seemed like the writers and director got a little too big for their britches.

As well as that, once the plot really kicks in, I found the performers started to play their parts far too straight. The first half of the movie is pure hilarity, then it gets very serious and turns in to a tribute to Baywatch, rather than a spoof. It should have taken a leaf out of Jump Street's book, in which it never took out the fun and steered away from the television series as far as possible.

It is simple, harmless comedy from start to finish. It certainly has its flaws, but Baywatch is a great laugh, and I would recommend it to anyone looking for a good comedy.

A new crew member turns up on Mitch Buchannon's beach while a criminal plot threatens their future, causing them to investigate.

Best Performance: Dwayne Johnson"
7.0,28 December 2019,All copies of this should be destroyed or deleted.
1.0,4 June 2017,"That's saying a lot cause The Rock is in it, and I mean you can't go wrong with the Rock and the Rock can do no wrong. He was funny as the head of the lifeguards who seems to take his job more serious than needed. Plus Zac Efron was funny too, as his foil, a hot shot Olympic champion who does not understand why the lifeguards are acting like cops. Plus I love Alexandra Daddario, such a beautiful woman, but a surprise to me that I found the women they got to play Pamela Anderson's part in the film more stunning, but she had an unfair advantage being next to Jon Bass who plays the lifeguard who looks nothing like the other beautiful people but had some funny bits that she got to tag along in, which made her look better.

Anyway, despite having the Rock in it, the movie Baywacth is stale as hell. It's not a matter of weather it's good or bad, it's a matter of it falling so bland that you can't even taste it. This movie is a waste of the Rock's time, and yours.

http://cinemagardens.com"
8.0,30 May 2021,"If you want dumb summer fun, than this movie does the trick. I don't understand all the hate for it... it's a Baywatch movie!"
6.0,25 June 2018,"It's no wonder movies are not as fast as they used to be when a good amount of the movies are either sequels remakes prequels or mix of all this one shouldn't exist at all it is a movie that proves that you shouldn't be talked into watching it.

Just because it was ""Based"" off a popular show doesn't mean it's going to be good let that be a lesson to anyone who grew up with this show this movie really proves to be beyond stupid.

This movie within the first ten minutes was clearly made by people who never seen a comedy before in their lives and that the target audience wasn't aimed at the right people.

Wasted ten good minutes that I will never get back and I got up and left the room because I value my brain more than to see a second of this curse film.

And it shouldn't be allow to be called a movie when it is just made by a munch of idiots that goes for the writers the cast and crew you should all be ashamed that you even agree to work on this movie for what? Because you were bored?

This movie should be destroyed no matter the cost and avoid at all cost.

I wish IMDb would consider a zero star rating because this is one of those films that deserves it

Baywatch gets a zero out of ten !"
4.0,3 September 2017,"This could have been much better, but there was too much confusion on which age group to target.

The mindless entertainment quality was targeted towards teens, but the vocabulary and sexual innuendos were target towards adults. This in my opinion was a fail.

Add to the fact that the humor was lame (and could have been better for either target age group), this film missed the mark drastically.

Even though I wasn't expecting much, I still expected a little more than what was produced.

Sadly, only a 6/10 from me."
4.0,30 May 2017,"I broke down and saw this on $5 day because to be honest nothing else I hadn't seen was playing. I wasn't expecting much and the film didn't deliver much. The plot is crazy and most of the jokes fall flat (most of the jokes are of the lowest type of sophomoric humor which I'm not a fan of to start, but there are funny sophomoric jokes, just not for the most part in this film). But that being said the women were beautiful and looked great in their swimsuits and I'm sure the ladies will appreciate Dwayne Johnson and Zac Efron, both of whom are absolutely cut. Of course next to Dwayne Johnson, Zac looks pretty small, but pretty much everyone does. The three female lifeguards are all very tall so as to not look ridiculous standing next to Dwayne (he still towers over them of course), but that means they are of course also taller than Zac. He gets most of his screen time with Alexandra Daddario who is about his height while Kelly Rohrbach and in particular Ilfenesh Hadera are taller than him. Tough to cast actresses who aren't too short for scenes with the Rock who aren't going to be too tall for Zac. The Rock really needs male co-stars at least 6' tall or so to not be totally overwhelmed by his size at 6'5"". All in all the film wasn't terrible due to all the eye candy, but frankly that's about all it has going for it."
7.0,27 March 2018,"I'm shocked by the terribly negative reviews. They read as if the writers were expecting a movie that aims for Oscar consideration or ""serious 'art,'"" or as if they expected it to be built with a George Carlin like comic style and genius. Baywatch should be judged on its own merits. If ""dick jokes"" as many have called them and or the kind of machismo humor used here offend you than perhaps you need to brush that chip off your shoulder and grow up. ""Childish?"" Maturity has more to do with an ability to cope and laugh at anything. An inability to do those, along with a need to appear adult like by rejecting some humor as inappropriate is by definition immaturity. If you don't like it, fine. But the horribly negative judgments are incredible.

This movie was HILARIOUS. Every movie has its place within every genre which also has its place, so this should be rated accordingly. This movie will make you laugh right from the start as long as you see it for what it is. It is a satirical comedy with an exaggeration on real life people, their egos, and the craziness they can get into. Along with Girls Trip, by far the best comedy of the past 5 years imo. I only gave it a seven because, after all, it still isn't ""great art"", nor does it have the strongest story line, but nevertheless, it entertained me so much it is only the second DVD I have purchased after seeing a movie in a decade."
1.0,17 August 2017,"Seriously, what is going on with you Americans? Are you really all as stupid as this movie, whooping and hollering to anything that moves! This movie is an absolute farce, it was OK for the first 15 minutes then became cheesier by the minute! The acting is terrible, the storyline and plots were pathetic, and if they had kept it to lifeguarding and general beach mishaps then it may have been OK! And wtf is going on with Zac Efron these days with his fake tan and plastic muscles? And if anyone lets their kids watch this perverted load of donkey turd then they want shooting through the head!"
7.0,1 June 2017,"'BAYWATCH': Four Stars (Out of Five)

A satirical feature film adaptation of the 80s cult classic TV show, of the same name, starring David Hasselfhoff (who also has a cameo in this movie, along with his TV costar Pamela Anderson). The film stars Dwayne 'The Rock' Johnson, Zac Efron, Priyanka Chopra, Alexandra Daddario, Kelly Rohrbach, Jon Bass and Ilfenesh Hadera. It was directed by Seth Gordon (who also helmed 2011's 'HORRIBLE BOSSES' and 2013's 'IDENTITY THIEF') and it was written by Damian Shannon, Mark Swift, Jay Scherick, David Ronn, Thomas Lennon and Robert Ben Garant (Lennon and Garant are of 'RENON 911!' fame). In the film Johnson plays the self righteous leader of a special team of lifeguards, which fight crime on the beaches of Emerald Bay, Florida. A disgraced former Olympian (Efron) is added to the team to help with PR, while the lifeguards try to take on a corrupt business woman who might be smuggling drugs. The movie has received mostly bad reviews from critics, and it's also disappointed at the Box Office so far. I found it to be much better made, and more entertaining, than the critics have given it credit for!

Lt. Mitch Buchannon (Johnson) thinks way too highly of himself, and his job as a lifeguard, and he often upsets the local authorities, and his captain (Ron Huebel), by investigating crimes he has no jurisdiction over. So when Mitch finds a bag of drugs on his beach, and suspects a local business woman (Chopra) is to blame for it, he gets himself, and his team of lifeguards, in a lot of trouble trying to prove his suspicions correct. At the same time Mitch also has to deal with three new recruits to his lifeguard team, including a cocky ex-Olympic athlete named Matt Brody (Efron). Brody and Buchannon's enormous egos both continue to battle each other, while they also try to keep their beach safe.

The movie is surprisingly entertaining; it's consistently funny and the action scenes are pretty slick and exciting too. Going into the film expecting it to be a bad movie, I'm sure helped it's enjoyment level for me as well. I think The Rock and Efron are both great in the film, and they also have pretty good chemistry together as well. Chopra makes a great femme fatale villain in it too, and Bass is pretty funny also. It's just an all around amusing and fun time at the movies, and it's much better than the TV show it's parodying as well.

Watch our movie review show 'MOVIE TALK' at: https://youtu.be/4Bt6rG-Wb0c"
4.0,13 May 2019,
7.0,29 May 2017,
3.0,17 August 2017,"Well, here's a film that thinks shoving tonnes of dick jokes (and dicks!) in the face of the viewer will induce laughter. I'd liked Seth Gordon's ""Horrible Bosses"". It sortof struck a balance between good humor and crass humor, and the cast shared great chemistry amongst themselves. But 'Baywatch' is a different scenario altogether.

The ensemble comprising of Dwayne Johnson, Zac Efron, Alexandra Daddario, Ilfenesh Hadera, and Kelly Rohrback all felt like they were playing 'wannabes' in the film. In fact, they seemed to be playing semi-parodies of themselves. There's a far-fetched plot line where a bunch of life-guards try to expose the drug-ring run by Victoria Leeds (played by Priyanka Chopra) and their sordid attempts at evoking hilarity.

The group seems to tick-off every stereotype known to hamper the fun element in films such as these. There's the out-of-shape I.T nerd (Jon Bass) who lusts after the hot blonde (Rohrback), the tough woman (Ilfenesh) who's exuding tough-woman vibes 24^7, the young spoilt achiever (Efron; who needs external help to realize his true strengths and the gratification of work in a team rather than alone), the brunette who helps the spoilt dude in 'finding himself', and led by the biggest badass of them all - Mr. Tough Guy Mitch Buchannon (Johnson).

The biggest flaw with 'Baywatch' is that the movie sticks to either one of the extremes - deadbeat or downright ridiculous. The women are more or less eye-candy placements, the men make terrible decisions and are subjected to dick-jokes every now and then..in short, the character arcs are not one bit worth the buy. Although, I should be honest in saying that the actors could've performed better had the writing been of higher quality. Even the cameo placements of Hasselhoff and Anderson are executed in a slipshod manner. Chopra impresses in her comparatively less screen-time-occupying role. If your idea of 'awesomeness' is an abundance of boobs, dick-jokes and sloppily executed set-pieces, then this film is for you. 'Baywatch' is at best, a throw-away afternoon watch.

Verdict: Not exactly the movie that turns things around for the brand!"
10.0,11 March 2019,"I didn't have high expectations for an Oscar nominator, and Batwatch met that. It was predictable, sexist, cringy at times, but I got a kick out of it.

My biggest gripe is that it didn't know what it wanted to be. At times serious, others quirky and at times trying to be a caricature of the TV show. The problem was that the characters themselves did the same, not just the plot, leaving me really disliking (as a character) many of the antagonists."
7.0,25 August 2017,"I usually write lengthy detailed reviews of movies, but honestly, this time I can't- this one was just terrible. Period. The writers could have done a better job of making fun of one of the cheesiest TV shows ever. The jokes were predictable and quite stale. The sexual puns were just less than childish. The girls were pretty hot however but the males were over the top ridiculously over buff, if that's a term. The cameos were totally unnecessary and silly. This was slapped together too quickly and not thought out very well. Hey- but if you've already watched everything else, you like face palming, sighing, and getting a lil puke in your throat, then, by all means, watch this. Honestly, I got one lil chuckle... or was it a hiccup?... idk."
4.0,16 August 2023,"Characters Literally hate to be called just lifeguards or Baywatchers , ... I found it insulting to both viewers & actual lifeguards , what's with all explosion , motorcycle chases , long violent fight scenes !? How desperate the production team were to keep the viewers on screen !? They thought even unnecessary 80's fashion of high-up ""swimsuits"" with open zips cleavage scenes , adult jokes aren't enough , So let's go Miami Vice mixed up With badboys !!! What's so great about showing people who came to watch beaches & bays , instead whatching dead bodies in morgues & NONSTOP crazy fight scenes & explosions & childish kevin hurt style of bickering ... Are U serious ?!"
1.0,18 June 2017,"I honestly don't know where the negative reviews are coming from. I mean haven't they seen the original Baywatch or what?

What really made this reboot succeed is the fact that it used source materials, it doesn't try to be different or new, it simply follows the original Baywatch.

It had the right amount of titties, dicks and ass just like back in 1989. It had great comedy, chemistry between The Rock and Zac Efron. Support cast was also likable.

The only downside is that after the first half of the movie some scenes started to drag a bit and kinda lost it's charm, that the first hour had and some jokes felt forced on. Still a great rated R fun.

I haven't laughed that much in 2 hours for a long time. Recommend!"
7.0,31 May 2017,
1.0,27 June 2017,"I went into this film thinking it was going to be serious and that I would judge it as such. After the hilarious over the top open sequence it's clear this film as no intention to take itself seriously, and neither should you. It's not trying to be a gritty hard hitting detective themed action drama masterpiece and I feel that's the standard to which this film is being held by many reviews. There are plot holes and some of the action scenes are over the top and unrealistic. One moment in particular when the main characters are hiding, laughing and making jokes not 5 feet from a couple of thugs without so much as a curtain to separate them, but it is a funny scene. The plot is thin and there is little character development but it doesn't matter. It's a silly, self-aware and ultimately fun film that makes no excuses for what it is or isn't. Don't go into this film thinking it's trying to get Oscar nominations and you'll probably just enjoy the ride."
6.0,11 July 2017,"Honestly, it's bad, but it still wasn't the worst film I have ever seen. Its acting is terrible (except the two I mentioned above), its characters are horrible, its writing is really bad, the villain is more annoying than menacing, and the jokes that it presents throughout the film are either okay or never cause a single chuckle. In the end I decided to give Baywatch a ""Bad"" on theVade Review Bar or a 3 out of 10. It is a forgettable mess that I would much rather get a sunburn over than see again.

Read more at theVade."
1.0,30 May 2017,"Loved This Movie!!!! It was hilarious with non-stop laughs and a lot of great one-liners. Too many people are trying to turn it into what it's not. It's a comedy and delivers on that front. Didn't feel like it needed a deeper story line because that isn't the purpose of the movie.

Would totally recommend this to anyone and would love to see it again!"
6.0,12 September 2017,"I rented this off a to be unnamed red kiosk machine and didn't expect much from it, but it turned out to be mildly humorous movie with a few laugh out loud moments. It was more entertaining than I was expecting and deserves a bit better of a rating on IMDb and on the review boards. It's too bad that it was trashed like it was, but then again, maybe that is why I liked it."
1.0,25 May 2017,"I don't claim to know much about the original Baywatch TV series (besides the obvious things), but I do know what a good comedy entails. I know that when I go to a comedy I expect to laugh. Baywatch rarely delivers enough action or comedy to keep the film from moving at a begrudgingly slow pace.

So, if it's not funny then what's the point? Well, there really isn't any. Baywatch attempts to follow in the same line with films like Fast and Furious where silly humor and visceral action lead the way. But there's a big difference here. Where in other films it feels funny because the characters inside the story don't realize how serious they're taking the situations they're in, it's the opposite with Baywatch. It almost feels like the characters in Baywatch know they are in a ridiculous comedy and continue to act like it, coming ever too close to winking at the camera at times.

Films like that only work if the tone is just right. It's very difficult to pinpoint who exactly this film is targeting. You'd think it's the R rated comedy crowd, but the film recycles so many old jokes and comedy tropes that I would find it difficult for anyone to get super invested. When the jokes aren't hitting you have to look to the characters for something to grapple onto. All of these actors and actresses are beautiful to look at, but besides Zac Efron's character, none of them are fleshed out. In my mind The Rock can do no wrong, but I certainly would have expected more out of him (especially considering he helped produce this as well).

The worst part is that you can see every story beat coming. You know when someone is going to get the girl or guy they want, you know when they won't, you know when the characters are about to go through a big moment, and you know when the big gag or joke is about to hit. I didn't even mention how pointless and out of place the cameos feel. I haven't seen all of Seth Gordon's directorial efforts, but I really enjoy Horrible Bosses so I expected to at least get a kick out of Baywatch/superheroes on the beach, but it wasn't meant to be. Man oh man is it hard to make rated R comedies these days.

+Efron is redeemable

-Nothing lands

-Rough green screen

-Predictable at every turn

4.2/10"
10.0,22 December 2018,Can't imagine how or why this movie got made. Bizzare!
6.0,11 February 2018,"I am 1/2 into this ""blockbuster"" and I have seen enough Do yourself a favour give it a miss"
1.0,6 May 2019,"There are definitely some proper laughs on offer in this one, several of the ad hoc banter between the actors are really funny, and I'm hard to please when it comes to that sort of thing. There is a good climax at the end, the negative of the execution is that there are some corny detective gags that are uncalled for. Cameos, yay.."
4.0,10 March 2018,"I did give the movie a chance and I am a was a fan of the 1989 version but this was so disappointing on so many levels. I did not like the swearing, did not like the story line and the acting awful. I wish I had not watched the complete movie."
6.0,17 August 2020,"It has a couple of decent moments, but 'Baywatch' is mostly uninspiring.

For a comedy, it takes itself way too seriously in parts. None of the heartfelt stuff really lands, while a lot of the humour is over reliant on sexual innuendo. The premise is followable, if entirely predictable. The cast is oversized, way too many characters. Dwayne Johnson and Zac Efron are good enough in their respective roles as Mitch and Matt.

Summer (Alexandra Daddario) and Victoria (Priyanka Chopra) are alright but underdeveloped, as is Stephanie (Ilfenesh Hadera). C. J. (Kelly Rohrbach) and Ronnie (Jon Bass), meanwhile, are annoying and extremely pointless. Yahya Abdul-Mateen II (Ellerbee) is solid in a small role.

I've never watched the original television series so maybe I missed a few callbacks etc., while there are two (incredibly forced) cameos from it. If it stayed at what it should be - a comedy - then I may have liked this, I simply didn't though.

Not terrible, but I still wouldn't say you should rush to see this."
