Rating,Review_Date,Review
5.0,25 October 2017,"Greetings from Lithuania.

You can summarize ""Baywatch"" (2017) in one sentence - exposition of good looking bodies and missed opportunities.

I was really looking forward for this movie. Premise was great - it could have worked as good comedy. Unfortunately script of this movie is beyond anything that could have made this movie work - it has zero suspense, zero humor (not a single really funny moment during whole 2 hours) and lack of any creativity. Plot was beyond average.

Overall, basically nothing worked in ""Baywatch"" because of very poor script. It is not a funny comedy and as some sort of action comedy it totally lacks any suspense or anything that resembles character development. Sure you don't watch movie like ""Baywatch"" for character development, but boy oh boy does it lack anything that resembles for a fun movie.

Unfortunately ""Baywatch"" is one of the worst movies of 2017."
1.0,25 June 2021,"I actually do need the beach right now,it was a fine experience that all things do eventually come an end but it was alright.

U guys might really want to see this,it would be worth the time."
6.0,9 April 2019,"The plot and comedy antics scream tween family movie, but the constant swearing makes it unsuitable for what should be the primary audience. Very confusing"
5.0,19 November 2017,"What the hell went wrong? I remember the old series and even if it wasn't exactly high quality TV, compared to this it was Oscar material. The women in this film are there to show of their boobs, the writer and the director seem to be oblivious to the fact that we have heads on top of our bodies. One man in this film are so taken by all these boobs that he end up in strange situations, why do the director want to give fire to the old (very old) belief that men are victims to their urges and can't control themselves? Really? And this in 2017? What will be the next project? A movie about a rape where they blame it on the victims dress?

So, it is worse than After Earth? Yes. Both movies suck, but this one is sexist beyond belief. Spend your money on some corn seeds and watch them grow, that will definitely be more interesting."
6.0,14 August 2019,"It's by no means a ""Great"" or ""good"" movie. But it's pleasant enough to stick on and not pay much attention to. Probably won't watch again. But it was alright."
4.0,24 November 2018,"Baywatch is a movie that just stands out because of the name of the old tv show. This movie is dump, unfunny and boring.

First of all: I didn't expect anything like a deep story, cool characters or even good effects. I just wanted to watch this movie with some friends to see if its funny. But after I saw the credits, i can say that it is not even that.

I only laughed like one or two times in this movie, although it is a comedy film. Most of the jokes are not funny, some are even really bad.

The actors are not good at all, just one or two. Something like a character development or a tiny bit of a story doesn't exist at all. Everything is too predictable.

It' s not even entertaining to watch! There is never something like tension or a plot. And the computer effects look like there were made by a 14 year old tennnage boy who just learned about Windows Movie Maker.

I normally don't write reviews. But in this case I have to warn you to watch the movie. It is a waste of time and money. And it is not even good for a funny evening with friends!"
6.0,18 August 2017,"Based on the reviews and ratings I saw before hand I expected this film to be a weak plot with horrible acting. I was, however, presently surprised. Being in my early 30's I vaguely remember watching the original Baywatch on TV. I do remember just enough of it to get a few of the easter egg jokes in this movie.

This is a comedy! The movie purposely does not take itself seriously. The whole concept of the movie is this group of over-zealous lifeguards who take their job way too seriously, while the real world around them is ""tolerating"" it. The dialogue between the characters is actually well delivered by the actors. I legitimately laughed and replayed a few scenes. Any corny one-liners or cringe moments are obviously done on purpose as the other characters will react to the cringe appropriately.

One of my favorite scenes is when all the characters are sitting around the table trying to explain to Zack Effron why their job is so important. Reminiscing about situations (old Baywatch TV episodes) when these ""lifeguards"" had to stop thieves from smuggling diamonds in surfboards or ""sand-grifters"" stealing from people on the beach. To which Zack Effron says ""That sounds like a really entertaining but far-fetched TV show, but if that was the case I would definitely just call the cops"".

Dwayne Johnson does a great job of being the ultimate boy-scout lifeguard as ""Lieutenant"" Mitch Buchannon. A military title every questions yet he never actually explains. Kelly Rohrbach fills the role of blonde bombshell CJ Parker (originally played by Pamela Anderson) with her slow-mo runs down the beach while looking sexy then walking into a plant off-center frame. Zac Efron's Matt Brody is called everything from ""One Direction"" to ""Highschool Musical"" by Dwayne Johnson in the movie. I don't think he ever called him the same name twice.

This is definitely a funny movie with enough ""R-rated"" jokes that anyone can appreciate. You don't even need to have ever seen a real episode of Baywatch to get the humor and appreciate this movie. It's a fun movie to watch with friends or by yourself at home. You don't have to pay attention too deeply and it comes with lots of laughs. I do not regret watching this movie."
4.0,27 May 2018,"This was stupid, gross, and awful. I don't rate movies. But this one was bad."
10.0,10 June 2017,"Critics tend to rate from too much of an artistic angle and seldomly write reviews from the perspective of a viewer. If I were to write reviews on a movie I don't like I would also say the movie's fun quotes are not funny, crime scenes are not intense, and overall plot does not deliver. I watched it I liked it. I never even saw the original Baywatch but it doesn't matter. I literally laughed out loud in the first 20 minutes and there were many more funny enough moments to keep it going. So don't get hindered by the critics' reviews, especially not Rotten Tomatoes, and let yourself have some fun. Could it be better? Sure. But why does it matter when you enjoyed it thoroughly?"
7.0,24 May 2022,"Somewhere in all this material there is a decent movie that could have been released; unfortunately the editing is amongst the worst I've seen in a film. It's a shame, because while nothing would have made this a good or classic movie, a more competent edit could have given us a good enough summer popcorn comedy. The actors are capable, there's a potentially servicable if basic and forgettable plot, and there's a few genuinely funny jokes.

The editing, however, is absolutely atrocious. I'm not one who generally pays much attention to editing, transitions, etc. But this film makes all of the above obvious in addition to being poorly done. Scenes are just rammed together like a combination between a sketch show and the ideas in the high school presentation you never found time to finish properly. There is absolutely no attention to flow, story, or transition. There are multiple scenes included that rehash the same plot points that then ultimately get dropped, and it seems like every dick and fart joke filmed got kept like it was gold. There's points where several diolog takes are obviously pieced together without even normalizing the volume level between them, which leads to rapidly changing volume and background noise when some characters are talking. Then on top of that some genius throws music overtop that's louder than the actors delivering the lines.

There's still some enjoyment to be had, but this is a masterclass in how not to edit a film."
1.0,31 May 2019,"Some good scenes, some funny scenes but most of it is not worth watching. Johnson is good as always and as in all his films but a couple of good actors cannot make a film good if the script sucks. And it's all common lieu, already seen, already heard etc. I don't even remember where I watched it, whether in a theatre or streaming....I removed it."
1.0,25 March 2018,Really wanted to watch this movie but after only 5 minutes I could not watch it any longer with all the f words very disappointed Dwayne could make a movie like this
7.0,8 June 2018,It's entertaining - sometimes it's so bad you can't help but like it. Critics giving this movie a bad rating had unrealistic expectations.
4.0,25 October 2020,The comparison of The Rock and Troy Bolton really put it in perspective of how short Zac Efron is.
6.0,28 February 2021,I think it's really funnny. Story is simple and predictable but has some good jokes
1.0,21 November 2021,"It's a dumb movie about a dumb show, which has dumb characters and dumb storyline. It is a perfect movie to turn your brain off to. It is bad but in an entertaining way. The main charm comes from the fact that it doesn't take itself too seriously."
7.0,31 March 2018,"So I just watched the Baywatch movie.

It's very uneven. Its main storyline was something from a pg movie with no real danger (real Scooby Doo pantomime stuff) yet the humour was from a gross-out r rated flick

The alleged comedy sidekick (who inexplicably gets the girl he lists after all movie) is awfully unfunny!! This type of character would have been cut from the American Pie type movies, so god knows how he made it in this.

It wasn't all bad. I laughter twice once when Efron said ""Everything you are talking about dealing with, sounds like an entertaining, but far fetched tv show"" And when the Rock made Efron fall in to the pool, the Hasselhoff cameo raised a smile (though I'd wish older celebrities would not have so much plastic surgery) All the cast look good none more so than Alexandra Daddario WOW I'm developing quite the crush on her!! The other babe Kelly Rohrbach was easy on the eye too, and I have to admit Zac Efron is winning me over.

I'm surprised this did as bad as it did, as I thought there would have been an audience for it!!! At least during its opening weekend, I'd have thought name recognition and the billing of The Rock and Efron would have brought the crowds in. Even changing its release date twice didn't help it."
3.0,1 January 2019,"I watched this in the plane because there was nothing else. It put me to sleep, which is good enough I guess."
10.0,29 May 2017,"I waited for an entire year for this movie to come out, even though I had never seen the TV show. I think that what a lot of people where hoping to see was hot chicks in bathing suits in a crude comedy movie, however they got an exciting action film with lots of muscles and crude jokes from time to time."
7.0,3 June 2023,"Common signs of political corruption include bribery, lobbying, extortion, using corrupt police, and intimidation. These strategies were used by Victoria Leeds, a successful businesswoman and owner of the Huntley Club, to increase her ownership share in the island for her own purposes. Despite Matt Brody's reputation being tarnished due to a drinking incident and his lack of expertise, she gave Captain Thorpe strong instructions to appoint him as the head lifeguard in order to attract media attention. Olympic gold medalist swimmer Matt Brody is immediately selected for the Baywatch team without having to try out or prove his eligibility. He is a good swimmer, but he also needs to be familiar with the lifeguard training that is required which includes CPR, first aid, victim assessment, rescue techniques, injury prevention and facility safety, as well as patron surveillance. Matt eventually swallowed his pride and decided to take lifeguarding seriously and learn from Mitch that their job was not simple and that they were real-life heroes, he was welcomed into the family."
1.0,31 December 2018,"Very bad film, very bad acting, very bad script, unlike the series, I am not sure why they make remakes of Drama series into action comedy films. It only worked with 21 Jump Street, other than that, it is not working."
2.0,8 June 2017,"I will make an effort to write only good things, to see if I can. I say this because, in my opinion, such films should not exist. But mankind must have some fun, it's still going to the cinema. So, Dwayne Johnson: probably in real life is a cool guy, I feel this from his presence in movies. Priyanka Chopra: It would be good to stay only in Bollywood productions. And, she might well have Zac Efron as a partner, playing white Caucasian males. Alexandra Daddario and Kelly Rohrbach are both beautiful and talented. Being actresses, they have to eat too, so I understand them perfectly, they accept almost anything. That's it! Ah, in the final credits, there is a cool song!"
6.0,6 May 2021,I actually really liked it! I know it wasn't the nicest I found the story really strong without the acting. It was a big let down for people seeing the cast then watching the movie. But I thought they did the best that they could and made it funny. I feel like the movie isn't supposed to be taken seriously imagine this really happening lol. I loved it great job.
3.0,19 June 2017,"..but at least fun. Well what could you expect from a remake of a mediocre (but damn entertaining) TV series. I guess I was a bit naive. But I at least expected more self irony but instead the film took itself too seriously. The slow motion stunts or Dwayne Johnson jumping into the water in slow motion really got old after some time. Zac Efron wasn't much better in that case but at least some of their little intimate battles were fun, at least more fun than the story itself which felt like it was copied from a TV episode and enlarged into an overlong episode or overlong movie in that case. There was some pretty cinematography and several nice action scenes also the cameos of David Hasselhoff and Pamela Anderson were refreshing (tho also I expected more in that case) but overall it was very dull and uninspired. Oh the soundtrack gets most of my kudos actually."
7.0,6 April 2021,"Does this, as a movie, deserves 6/10? Probably not, but it's exactly what is supposed to be: a light dumb stupid entertainment for your Sunday afternoon. It was funny enough, stupid enough, cheesy enough. I can't complain."
3.0,6 February 2021,"I'm not going to pretend that this is about movie making or whatever. Yes, I get it. It's only a bait for those who enjoy watching a few actresses and actors a bit naked. But that's exactly what it's all wrong about this movie. Hollywood, the biggest money making factory on the earth, which is vehemently calling for women rights and so on, which stands against all kinds of misuse of women and not objectifying them, with all their political agendas and virtue signalling all over the big stages, they themselves create a movie which has got nothing but objectifying women and men for box office. If this is not the biggest hypocrisy in the world, what else is it?"
7.0,21 July 2018,I don't usually leave reviews but felt this one was needed. I actually really enjoyed this movie. I ran across it in the free movies section on demand. It did have a corny typical type plot. But I laughed a lot. Lots of silly jokes. Loved watching The Rock pick on Zac Efron throughout the movie. Plus lots of attractive people in bathing suits. Haha. I'd say this movie is worth a try. You'll know in the first ten minutes or so if you're gonna like it or not.
5.0,28 August 2017,
8.0,3 June 2017,"Baywatch was such a funny movie and is probably going to be the best movie of the whole summer. This movie keeps you entertained the entire time and again is so funny. I have never seen the original show so I have nothing to compare it to but it reminds me of something like 21 Jump Street. Throughout the film there is lots of action which is exciting and all the actors and actresses do an excellent job! Ignore the critics and go and watch Baywatch, I have actually already pre ordered a digital copy I liked this movie so much! I hope more people watch it so they go and make a second film. If you don't watch this you are really going to miss out!!!"
1.0,9 October 2018,"This film was better than I thought it would be, but then I was not sure what I was expecting. However, I most certainly was not expecting almost a spoof like comedy. That being said, sometimes it played like a spoof comedy, sometimes a raunchy comedy and sometimes like a straight summer comedy with some action within it. It was very uneven as it did not seem like it knew which style of comedy to settle on. Still, it was funnier than I was expecting and thought it was uneven, it still proved to be entertaining.

The movie stars the Rock as Mitch, one heck of a good lifeguard. He is about to be saddled with a new recruit whose only attribute is that he is a gold medal swimmer, but he has an attitude! He also has a portly guy he personally chose and a female that the gold medal swimmer is attracted to. Soon, a death is discovered and Mitch just knows that there is something going down and starts an investigation, while the gold medal swimmer is confused by this as this is a job that is seemingly more fitted for the police!

The movie was funny, despite the flow of the film which seemed really uneven. Dwayne the Rock Johnson does a pretty good job with comedy and so did Zak Efron. The film did feature a couple of appearances by former Baywatch stars, but both amounted to simple cameos. I found it stupid that they put their names in the main credits as this kind of took away the surprise when you finally saw them.

So, a pretty good comedy that could have just stayed a bit more consistent. Be a spoof, be an action comedy or be a raunchy comedy, but don't try to be all three within the span of 10 minutes. The Rock would go on later in the year to make the far superior and much higher grossing Jumunji, but while this one did not score huge at the box office, with its world wide take was still a hit for the Rock. He has become the Arnold Schwarzenegger of this generation where his films do pretty good or great in the US and if they fail a bit here, they do well overseas."
4.0,30 August 2017,"Another Hollywood movie which couldn't help itself engage in depicting unrealistic, cancerous, politically correct scenarios. The most poignant is how an overweight, geeky, unfit, awkward man can somehow beat out an entire squadron of fit, healthy and more suitable contenders to become a lifeguard - because he tries hard. The fact that the producers would even try and entertain this notion is mind-boggling. Coupled with the flagrant overuse of super-women stereotype makes one nauseous. These politically correct skits are so boring now. Wake up Hollywood, the overwhelming majority of people reject political correctness."
7.0,10 March 2021,"Would have been a zero, but one star because Alexandra Daddario is in it."
1.0,25 August 2019,So at first I was like another remake of tv series. Baywatch was a really good tv series to watch and thought this film was not going to work. But I must admit it was not the best but it was okay and entertaining to watch. Zak Efron and Dwayne Johnson were really good working together plenty of laughs with action in the film. I think it should have got a bit better rating
7.0,3 September 2017,"The trailers for Baywatch might lead you to believe that this film is a funny, meta send-up of the original TV series. Yet when the movie begins with a tepid ocean rescue played straight, it immediately confuses the tone of the film. That sums up Baywatch. This movie doesn't know what it wants to be.

There's a running gag in this film about the Baywatch lifeguards refusing to understand that they're not law enforcement. It's hilarious satire of the original show and the entire premise, and the film almost starts to sound smart in these moments. The script keeps returning to this joke and it remains humorous, but there's no real payoff.

Other humor in the movie is sporadic. The Rock and Zac Efron have chemistry as rivals. Efron is especially funny and the highlight of the film. Aside from that, there is some gross-out humor that doesn't work, and the rest of the story is played as a straight and dark action piece. There was potential for the action sequences to be played for comedy, but they're strangely earnest. Even when an action sequence strives for humor (in particular a tussle between Dwayne Johnson's Mitch and a henchman), it feels like a weak attempt.

In the end, this film doesn't gel. It wouldn't have worked at all if it was just a self-serious action spectacle. But the comedy that's there is lazy and occasional. There was probably a better version of this film that went further into Police Academy-level absurdity. What we got was a mish-mosh of a movie that feels unfinished."
1.0,19 August 2017,I don't why people are giving bad reviews but today i watched this film and it is not that bad. I enjoyed the film and i want to watch it again. I don't have any complain about anybody's acting or anything. I love all of them. Story is nice. It is really funny and entertaining. You should watch it.
6.0,8 October 2019,There's one amusing moment when a goon gloats over his taciturn sidekick's taciturnity - and said sidekick ruins it by promptly chipping in with a comment of his own; and that's about it for nearly two overproduced hours in which the constant use of giddying steadicam attempts to compensate for the fact that little is actually happening that is worthy of your attention. But Alexandra Daddario makes an attractive Summer Quinn.
1.0,15 September 2024,"Baywatch is a 2017 action comedy that follows a group of lifeguards who must take down a drug lord in order to save their beach.

Based off of the television series of the same name, Baywatch is a pretty good comedy that I enjoyed a lot more than I thought I would. Although I was never a fan of the T. V. show, I thought the film did a good job with the comedy aspects which is something the show kind of only did unintentionally. The sense of humor that the characters brought out of the films mediocre story kept things entertaining and made me want to see what was going to happen next. The cast was decent with the Rock and Zac Efron giving a good performance and playing off each others insults well, and of course there's plenty of beautiful women just like the show.

It's not going to become an instant classic, but I was definitely entertained. If you haven't seen this silly flick before, it's worth checking out at least once."
8.0,9 August 2019,
6.0,2 June 2017,
1.0,30 September 2017,"I watched this purely because I'm a Dwayne Johnson fan.

Even he could not redeem this trash beyond a single star.

Actually I can't even find the words for how bad this was. Over acted, over edited, absolutely D grade toxic rubbish.

So much gratuitous swearing was used - and it just made it go from bad to worse and then worse again .

My intelligence is deeply offended at having paid to watch this garbage.

Please do not bother !!

Sorry - Dwayne ... but sack your agent asap..."
