Rating,Review_Date,Review
8.0,11 September 2022,"The plot of the movie was similar to the TV show (I think so) and it was kinda interesting. The storyline was kinda well-written, of course I think there were plot holes and some unexplained questions. The location of the movie was really good, I really liked the beach and the whole summer vibe! The characters weren't very interesting, but they were so likeable and funny. There were many jokes in that movie, most of them were very funny. In my opinion, it's an underrated movie that comedy and crime were combined really well! The duration of the movie was fine, I didn't felt bored at all. Because, it was an intense movie. Also, the casting was really good and the acting was hilarious! The 3rd act was very well-developed and it was action filled. In my opinion, that movie deserves a sequel. Moreover, the cinematography of the movie was really good and the quality was amazing. Last but not least, the movie was totally unexpected and I'm glad they didn't follow the same concept, that the TV show had."
7.0,14 June 2018,"It's Baywatch. You should have known that this was about hot girls, fake detective work, some crazy stunts, and some corny ass jokes. This movie delivers some good laughs and doesn't take itself too seriously. It was far better than the TV series. It's not cinema verité people. Just a fun flick."
1.0,1 July 2017,
1.0,18 May 2018,"I didn't even make it 1/4 of the way through this movie. I thought it would be fun to watch while running on the treadmill. I felt blindsided by the dick jokes, the sexism, the objectification of women AND men and their body parts, the unlikeable characters, the cheesy lines, etc... I think some of these things would have gotten a pass 20+ years ago (sadly) and I was disheartened to see a movie like thjs made in 2017. It was the worst 20 minutes of film I can recall ever seeing. And I've seen THE ROOM."
7.0,19 August 2017,"""Baywatch"" suffices as mindless entertainment. I've never seen the television program, other than a clip shown in ""Red Corner,"" so can't compare it. It has the feel of a script written for television, but with a bigger budget and greater freedom to present adult-ish content, which actually seems geared more to adolescent boys. As such, it seems a bit incongruous at times, trying to titillate without getting raunchy. There are several action scenes and car chases that are well executed, a few nods to the original series, some self-deprecating humor and self-parody of the type seen in ""22 Jump Street."" Although the premise is unrealistic, the actors never seem self-conscious and don't wink at the camera, which helps make some of the weaker humor funnier, as if the entire cast is playing straight man to the original program's screwball. It doesn't try to be the least bit cerebral or cathartic. But as light entertainment, especially for somebody who missed the television program, it gets the job done.

Kudos to the filmmakers for using some sort of rigid camera mounts, avoiding the jigglycam shots that are overused in many films."
1.0,2 June 2017,
7.0,27 August 2017,"A few objectification, some weak punchlines. Seems pretty loyal to the original series. This is still pretty goldhorrible, I mean, it is a movie with a bunch of actors known - I'm not saying they're not talented, I love The Rock and Priyanka's work - for their beauty and stuff. Anyhow,if you want a film to spend time and give some laughs, this is it!"
5.0,29 May 2018,"The show may not have been great but it sure left a mark on history as the sexist show. Baywatch was never a comedy, only model driven people who loved to show off their bodies and rescue people. Nuff said

Did I say it was never a comedy."
6.0,12 October 2017,"The names The Rock calls Efron are funny. Always a reference to something and it had me rolling because of the way he delivers it. I like that they made Baywatch into a comedy. I was hesitant about watching because reboots of a show/movie are not usually good and lately that is the new thing. I thought it was going to be like the show and the seriousness of it, but then The Rock knows how to do both, so I was iffy. I saw a few minutes of the original when it aired and I did not like it at all. I could not finish it. Everyone talked about the show and it wasn't for me. My husband wanted to watch the movie and I found it enjoyable. I hope they make more and keep Hasselhoff off. He aged horribly. I don't know why they made The Rock's character Mitch Buchanan. They should have named him something else, passing the torch or a relative. It would have still been enjoyable and Pam looked wonderful. I hoped they would give her a better part."
1.0,29 June 2018,"Baywatch: Directed by Seth Gordon and written by Jay Scherick, Thomas Lennon, Robert Ben Garant and David Ronn

I knew better. I didn't care about the show. I saw through what they were trying to do from the trailers. They were going for that 21 Jump Street thing where they basically make fun of the show while still remaining true to the spirit of the show. It's just too much.

It feels like Michael Bay made this movie. The camera is always swirling around making me nauseous. It has constant slow motion not just for the jokes on the show's liberal use of it. It has that trying to be bad ass slow motion. It has that Michael Bay thing about it. I know this is the point. It's the whole joke behind the film but it made me roll my eyes too many times.

The Rock is naturally fine in it. He's funny in the role and just enough over the top. Zac Efron is also good playing on the frat boy Olympic athlete image. It works for him. The problem is the women are window dressing. They have no character to speak of. They're only there to ogle and for the male characters to win. The original show wasn't like that. It felt off to me. I understand that everyone is meant to be watched and enjoyed for their physical appearance.

The main problem with this movie is it's just not funny. At all. I didn't laugh one time. It's gross out humor and it didn't need it. The schlubby guy wasn't funny either. The whole joke is he didn't fit the whole super physically fit aspect of the lifeguard and that's funny that he tries to fit in feeling awkward. It's not funny. None of this is funny even the jokes at the expense of the original show.

I say skip this one. I give it an F. I should have stuck with my gut feeling on this."
8.0,22 February 2019,If your after a great movie with the plot twistsing and turning then stay away.... but if you want escape life and chill out for 90 minutes and not take a movie seriously then I fully recommend.
7.0,23 October 2018,"I did not have my hopes high for this movie. I expected flat jokes and childish humor, however, the movie turned out to be entertaining and definitely worth watching! Of course there are some scenes that are too much and overdone and many jokes are cheesy, but all things consideret, it is a pretty entertaining and good humoristic movie with decent acting. Take it for what it is: a comedy!"
1.0,24 September 2018,"This was one of the most dissapointing, and terrible movies I've ever seen. Ay Iove Alexandra and I like high school musical. What I don't like is garbage and cancer and this garbage film gave me cancer. Now it hurts my weenis when I watch movies because all I can remember are the terrible boyband reference, the unfunny high school musical reference, and the rock being one of the actors of that year. Oh, and the KSI song was worse than when eazy-e got aid."
5.0,16 June 2018,Third grade soft-porn movie! I am utterly disappointed by watching this movie. Just body exposure is the worst form of objectification of women. The movie makers have tried to inject exotica by featuring an actress from the Third World. This could only satiate the sexual fantasies of the already over-sexed American male audience. As a pro-feminism male this is utterly unacceptable in a modern progressive society where women have been making giant strides in all walks of life.
7.0,10 October 2021,"Alright .. the world famous Baywatch . Basically one of my grandfather's favorite TV shows was Baywatch , he used to watch it a lot on Star World and would tell me about it and he used to tell me how distinguished these people were as lifeguards on the beach, but from the Baywatch, they were a lot more than just lifeguards on the beach, they were crime-fighters and mystery solvers as well. The original Baywatch TV show went on for a long long period , around more than a decade . I used to feel really weird why he's praising up this show .. Nan (grandfather) used to tell me if you can't find a job then just be a lifeguard on the beach 😂, that's how much he used to love this show . And I've seen some episodes as well . So this is like a remake movie of the original Baywatch in today's times . And I think they've given a super job with it . Honestly speaking, the responsibility the lifeguards have on the beach on their shoulders is insurmountable . Some stars from the original show also show up in this movie ."
5.0,24 November 2021,"This movie is so aggressively stupid it even fails to make every member of a cast that includes Zac Efron and Dwayne Johnson even the smallest bit charming.

It's not charmingly nostalgic.

It's not even funny.

It's just....nothing."
6.0,9 May 2018,
5.0,10 January 2019,"I would like to start out by saying that I am a big fan of The Rock. I also really like a few of the other actors in this movie (from other movies I seen them in). That being said, I have tried about 4 times to watch this movie all the way through, and I do not know why (maybe I just got really bored with it), but I just could not get through maybe the 1 hour mark, and had to turn it off, and watch something else. I am not sure that I have ever been unable to get all the way through a big budget movie, and this may be the 1st one. I understand that this review is not going to be the least bit helpful, but just wanted to post my thoughts anyways. I think that maybe the movie is just too silly (in my opinion), and I just got really bored with it. I never watched the classic TV show."
2.0,23 July 2017,"If all you're looking for in the movie is to laugh, Baywatch may make you laugh. In my case, though, I went expecting a super high quality movie. That wasn't the case. There were many scenes in which I felt like the editing wasn't good. It often felt as if it was filmed with only one camera. The story wasn't that bad, but it wasn't that good either. Baywatch has a lot of the elements that are common to comedies but that's exactly what made it a 'common comedy movie' - more of the same. It reminded me about the movie 'Neighbors.' I expected something better. This is definitely not a standard-setting movie."
10.0,28 December 2021,"This pointless, terrible movie adaptation is nowhere near as watchable as the original Baywatch TV series. This movie fails as badly as the later Baywatch TV series (set in Hawaii). Like most hit tv series and movies, it is the original cast, creators and writers which create the perfect storm for a hit. Any later attempted re-productions just fail miserably - it makes one wonder why the even bother."
2.0,16 March 2019,"I do not like Zach Effron. That being said, I loved him in this movie. It was the first time he seemed to not take himself seriously. The Rock delivers what he does best, action mixed with comedy. I should also stipulate that I actually hated the TV show upon which this is based. I did enjoy this movie from start to finish, though the plot was so thin it bordered on anorexic."
4.0,31 August 2017,Okay so granted it wasn't as good as everyone had hoped. There are quite a few funny points in the movie but it get's quite serious in others which sort of ruins the mood. It's a great cast but some of the jokes just seem a bit stupid or childish at times. It just a bit disappointing
1.0,29 September 2021,"Kachra hai movie.

Not worth watching. The Rock is boring as a rock."
5.0,28 August 2017,
8.0,28 January 2022,If you're a fan of Dwayne Johnson then this has some enjoyable set pieces and pokes fun at itself and the classic show. It is overly long and doesn't make a lot of sense after the first 45 minutes. If you have low expectations and want escapism only this is worth sticking on once on a Wednesday night. Definitely doesn't deserve sacrificing a weekend night for. You may switch off by the second half though.
2.0,12 December 2019,What can you say? It needed more Eye Candy to be honest. The story was so bland and the acting atrocious. Get a better script with stakes and plot twist next time. Very meh overall.
5.0,30 October 2017,"There are two reasons I thought one might want to watch this: it's stupid fun and it's sexy. But it was just stupid and not that sexy. For me, having Priyanka, Alexandra Daddario and Kelly Rohrbach in a movie and not have it be sexy is an awful fail.

And it could all been saved if the story would have been a little more interesting or the jokes better, but they just weren't. Did I have difficulties watching it? No. It was like a dumb TV movie that you can enjoy and I was on an international flight. But other than that specific situation, I can't imagine myself wanting to watch it."
1.0,16 May 2018,"Baywatch was a disappointment overall, sorry Dwayne but i think the critics have it right on this one.

I wanted to like this movie, I am a fan of the cast members. I love Dwayne Johnson and I like Zac Efron too. To be fair it wasn't the cast's fault that this film fell short. Johnson, Efron, Daddario, and the rest all did well with their roles and were good picks. To be completely they were the only good parts of the entire movie. Pretty much everything else was poor in quality.

The writing is lazy and the ""comedy"" isn't even comedy, it's completely unfunny. The movie uses crude slapstick as the basis for all of its humor and that is lazy. I didn't laugh at any of the moments that were meant for laughs. The action parts of the movie were decent, meaning that they were average.

I liked the actors and their chemistry, but that's all, the rest fell flat. 5/10."
4.0,26 June 2018,"I suppose, if you're a 13 year old boy, or you think repetitive use of the F Word, with every sentence, for every subject, in every situation is funny, or, dick jokes are your idea of entertainment...again 13 year old nonsense, go for it. If you're much, much more mature.... like, 14 ? Don't waste your time.

Man, I'm glad this was on Prime Video, and I didn't actually pay to see it in a theater. I'd have written Duane for a refund. Duane ! I'm embarrassed for you, you should be ashamed. Then again, you made millions, enjoy it, I guess, very few will enjoy your efforts in this POS. It could have been funny, or it could have had some good action scenes, or good dialog, or good anything. Sadly,,,no."
2.0,15 June 2017,"Keeps coming up with unexpected events, just making everything more fun to watch! if you are a teenager in your spirit - you will love this!! if you are just a boring narrow minded sucker like most movie critics you will have only insulting, dull words to say. Real humans, with a sex drive, love this movie!! Robot faces will hate it!"
8.0,13 May 2018,"'Baywatch' was a long running series that was largely successful because it didn't take itself too seriously. 2017's film adaptation pays homage to its source material, but instead could not possibly take itself any less seriously.

Unsurprisingly, the cast of characters who make up the Emerald Bay crew include Dwayne Johnson (what movie isn't he in?) and Zac Efron, plus standard eye candy in Kelly Rohrbach and Alexandra Daddario. Since this is a silly, juvenile comedy, we are graced with the likes of Jon Bass's Ronnie Greenbaum, who does anything he possibly can do to embarrass himself in front of his crush, CJ (Rohrbach).

At its core, 'Baywatch' is a loose drug bust wrapped in a slapstick comedy (sound familiar, '21 Jump Street'?), as the lifeguards try to get to the bottom of why mysterious drugs keep washing up on their beach, which then leads to other, more sinister things. Efron plays a disgraced Olympic swimmer who is sentenced to serve as a lifeguard, and let's just say people do not take too kindly to him at first. Businesswoman Victoria Leeds (Priyanka Chopra) also charms the lifeguard crew with a fancy club, but not all is what it appears to be.

But who cares about the plot?! 'Baywatch' is probably a low point for all of the actors whose names are attached to it, most specifically for Johnson (who will act in just about anything). There are pretty much no redeeming qualities here, and while there are some funny scenes here and there, most everything is rehashed, sloppy and just plain stupid.

Instead of giving 'Baywatch' a watch, just spend the day in the bay."
4.0,3 July 2018,"In the quotes section on here, there's part of an exchange between Dwayne Johnson and Zac Efron where they're discussing the kind of things the Baywatch team have done: Mitch Buchannon: ""How about diamond smugglers who are putting the rocks in surfboards and bringing them ashore?"" Matt Brody: ""Everything that you guys are talking about sounds like a really, like, entertaining but far-fetched TV show.""

I used to enjoy the original Baywatch series; it was fun to watch and added a bit of Californian sun to a dull weekend and had pretty ludicrous story lines that didn't feel forced; the diamond smuggling episode reference was back in 1993, and also included a group of frantic UFO experts. Zac Efron was five when that episode first aired, and this film watches like it's been made by someone who is that age now.

Given the cast, it could have either been a decent, feature length Baywatch adventure - akin to the episodes of old - or a poke in the eye parody, spelling out every cliche and plot hole from the old series. I mean, it could have worked if it had been a self aware comedy - breaking down the fourth wall like Deadpool, poking fun at the original series - yet switching between cock jokes and over serious spy scenes, it didn't get into a good stride.

Yes. they included plenty of nice shots of the beach. Yes, they included plenty of the signature slow motion shots (and mocking them accordingly). And, yes, they included plenty of good looking people doing daring do. Yet the ""baddie"" is so obvious, they don't need brain boxes to work out what's going on. Jon Bass as the comic relief - we get it; he's not the same as the other chiseled Life Guards - would probably be the lead in many other underdog films. And the cameos from Hasselhoff and Anderson don't evoke a sense of nostalgia but more a sense of depression that it's been almost three decades since the original series came out."
1.0,11 November 2018,"The script was bad, the acting was bad, and the actors were bad. I want a refund on the two hours of my life I wasted. Plus interest!"
5.0,29 May 2017,"Let's get the obvious out of the way. This is a remake of the '89 to '01 TV series, Baywatch. How does Hollywood remake it's classic TV? First, they take what was a serious show and turn it into a comedy. Then, they throw in a few unnecessary F-bombs. Then they include a lot of sex jokes, some of which are funny and others that are just stupid. They usually include one or two cast members from the original show (Of course it's going to be Hasselhoff and Anderson, who else?) And they throw in a bad guy, or in this movie, a bad girl.

And that is how Hollywood does remakes. They did that with Dukes of Hazzard, They did it with Starsky & Hutch, they did it with CHiPs, every remake had the same setup.

Set at Emerald bay, Mitch Buchannon (Dwayne ""The Rock"" Johnson) is a lifeguard who takes his job seriously. Backed up by the lovely C.J. Parker (Kelly Rohrbach) and Summer Quinn (Alexandra Daddario) and a few other co-workers, Mitch is setting up tryouts for the openings to the Baywatch team. While several potential lifeguards are putting an effort into their work, Former Gold Medalist Matt Brody (Zac Efron) is there for his own benefit. He and Mitch are at constant odds, when a series of drug packets, and bodies wind up on the shores of Emerald bay.

To be honest, I enjoyed this movie despite not really seeing the original show. I only watched Baywatch once during it's run. I was 7 years old at the time. It wasn't long after the episode ended I walked around with rigor mortis in my shorts that my mom said I shouldn't watch it anymore.

I can understand why people hate this movie - It takes it's source material, beloved by many just the way it is and dirties it up with a lot of swearing, unnecessary sex humor and other gross material. Some moments are funny, others make you shake your head.

But, I liked it. I'm not saying it's the greatest movie of the summer, because it's not. But it is a fun movie when you don't analyze it too hard. It's a 2-hour trip to the beach where you're going to have fun.

Just don't get caught checking out the lifeguards too much."
3.0,28 December 2019,"Silly puerile humour, paper thin plot and I loved it.

Sometimes you can just have a laugh."
10.0,18 June 2022,"Not funny, lousy, long, over the top, predictable, inaccurate, dull, really not interested in the crude jokes so ""no, thank you"" apart from the one slow-mo joke."
3.0,16 June 2020,"While this movie could have worked as a light-hearted summer movie with stupid jokes that it's starting out as, it really tanks in the second half when it turns into a boring crime comedy. The movie looks good, but it's just too silly, the characters are not really that likeable, the cast is giving a good job, but the humor is just all over the place and seldom manages to find the right tone or keep it for more than 2 minutes. I liked the idea of the female villain, however that's the only original thing about this film - but it's at least fun, even though it's often cringe worthy."
5.0,3 September 2018,"Over all the story line was bad, topped off with lame jokes. The cast had much more potential with a better script. I have to cut them a little slack though since obviously we didn't want to offend some of the viewers from the traditional Bay Watch delivery. I think the spent to much money on abs than writing."
2.0,19 May 2018,"Baywatch was hyped up and promoted heavily before its release. Upon the film's release, it has been considered a flop and has been panned from critics and fans. The film was supposed to be another Dwayne Johnson blockbuster, but wasn't.

Baywatch isn't as bad as some are claiming but overall the film just isn't funny and tries a little too hard. Johnson has charisma as usual but his chemistry with Zac Efron isn't there, and the constant back and forth jokes between them becomes tiresome quickly.

With some decent and entertaining moments, overall Baywatch didn't live up to the hype and has somewhat been forgotten already. With clear hopes a sequel (as showed after the end credits), we highly doubt that will still happen."
1.0,25 August 2017,
5.0,19 May 2022,"As I've said in the past, reviewing comedies is weird because, more than any other genre, humor really is subjective. So keep that in mind.. When I first went into this, I was expecting a cheesy drama action flick full of in-your-face eye candy. Well, I was only half right. It has its cheesy moments but they're mostly outshined by making fun of itself, immature yet personally hilarious humor (though I can see why some people wouldn't like it), and, yes, a very attractive cast. With its exceptions, and nobody except for maybe Zac Efron was a perfect 10. The movie really seemed to give an equal spotlight on both the men and women when it came to sexualization; they even joked about their attire in the bloopers. Plot wise it's just as silly and cliché as you might expect, but once again even the absurdities of the storyline are mocked in the script. Ultimately it comes off as a parody of the source material, and with David Hasselhoff in a funny cameo, you can tell they really just had fun making it. If you still expect any level of seriousness that lasts more than a ten second scene, or have an unusually mature sense of humor, you're not gonna enjoy this."
8.0,27 April 2019,"This movie comes well actually in the first minutes. They have jokes, occasional sensuality, skimpy clothes, and crude jokes. They even going meta for a few moments. All are good until the conflict comes, and I am just bored to watch the rest of it. I am not against this American crude comedy movie like this, but this movie offers nothing other than comical actions and hot bodies. I guess people say that you don't have to be serious to watch this kind of film, and I did.

I acknowledge this movie develops the plot and introduction well. The cliches used by this movie, Oh my God, are in the whole different level than superhero movies. This movie like to recycle all possible funny contents, with touching and philosophical meaning of being lifeguards, camouflaging and dumb faces from the girls, and thinking you could get away just because you got bodies as the safety net, it's just horrific.

Let's say that I give this movie stars because they have it good in the beginning. If they stick to the plan, going meta with references, or having more authenticity, I would love to give this movie more, considering that I never like a single type of film like this."
3.0,3 February 2019,"The movie is really bad. I mean really, really bad."
