,Rating,Review_Date,Review,Release_Date
785,9.0,7 September 2012,"There are very few shows out there (of which I had heard good things and so purchased on DVD after missing the airings on TV), of which I have felt absolutely 'compelled' to watch the next episode immediately... even if it meant I was awake until 3am or 4am, and yet knew I had to be up early the next day! Occasional shows have kept my attention so well, that I happened to 'chain-watch' episodes in one sitting, until the whole series had finished, and I physically had no DVDs left to put in the machine! The ones that spring to mind so far are: Journeyman (although, guttingly, they only ever made the one series), Prison Break, Peep Show (British), Friends, King Of Queens, and without doubt, Dexter. So if you have never really given this show a proper look, then please do so. You may lose a few nights, all-in-one-go, to this show, and may have a few 'zombie' days at work... but you will be immensely rewarded with unique entertainment like you have never seen before. And I don't think they could have found a more suitable actor to play the part of Dexter the serial-killer. I guess for those of us who watched Michael C. Hall in 'Six Feet Under', we were kind of already familiar with seeing him in a 'dark humour' role, but to be honest, it is too far a stretch to describe this show as black-comedy, because, although there are a few comedic moments in the show, it is definitely a true drama in its substance. But for something that many people describe as a 'dark' drama, it is surprisingly light viewing. By that, I mean, that for a show which focuses mostly on a serial-killer, it is not that heavy-going in the way that it is not a total gore-fest! There is a lot more to the show than meets the eye. It is not all about killing and torture. There are obviously going to be a few quease-inducing moments if you are of that inclination, but surprisingly, the producers of the show have been able to prevent alienating a massive part of the viewing public by doing it all without you having to see graphic violence. And this element of the drama definitely does not define what it actually is in its substance. There are many characters in the show which also give decent airtime, and each one of these characters is deliciously complicated. So we not only see elements of these characters which we then want to see more of, but, we get drawn into the psychology behind the characters too, which is ultimately fascinating, especially when they all seem to be so emotionally flawed in different ways. But the most startling element of the show, is that you, as a viewer, may seem to start understanding the psychology behind the main character, and almost feel as if you can 'relate' to a serial-killer! One of the ways in which the producers of the show draw you into this strange turmoil of emotions, is by making the main character so god damn likable!!! Now you are getting an idea of the complicated roller-coaster of emotions you may experience while watching this clever show. You seem to be eternally wrestling with your own morals and wondering about what we, as a society, actually accept in real life as being morally 'right'. The whole 'twistedness' of the concept, and how this constantly reflects on you and your feelings towards it as you watch it, makes it compulsive viewing for me. It really is probably THE best thing I have ever seen on TV. I gave it 10 stars, but if it was possible, I would have given it 11.","October 1, 2006 (United States)"
786,10.0,17 July 2018,I will wait for another season always. One of the best tv series ever!,"October 1, 2006 (United States)"
787,10.0,25 March 2023,,"October 1, 2006 (United States)"
788,10.0,29 September 2012,"Six Feet Under's Michael C. Hall is still dealing with death, just in a different way. In this adaptation of Jeff Lindsay's novel ""Darkly Dreaming Dexter,"" Hall stars as a forensics pathologist who moonlights as a serial killer. (He's not all evil, though; he only murders bad guys.) The first season of Showtime's ""Dexter"" is some of the best television I have ever seen. It is extremely dark material, probably the darkest TV of all time. It tries to get into the head of a serial killer, and it succeeds. What is particularly disturbing is that the viewer comes to identify with Dexter, almost hoping he lives to kill for another day. Correct: this is not for the faint of heart. Each episode is like a movie, with deeply cinematic qualities. Gorgeous cinematography, interesting dialogue, and smashing editing. Dexter is played by Michael C. Hall, who became a star via that other premium-cable pioneer, ""Six Feet Under."" Hall is absolutely superb. This character gives him a gigantic stretch, and Hall grabs the bull by the horns with gusto. The supporting characters are almost as interesting as Dexter, especially Dexter's sister, played by Hall's real-life wife, Jennifer Carpenter. I cannot believe that Carpenter hasn't gotten more praise for her work here. She brings this young woman's insecurity and cockiness to life in ways that I think make television history.","October 1, 2006 (United States)"
789,10.0,4 August 2018,I have watched the whole show two time ... 2014 and 2018 and I still can watch it after 4years from now ..... it is really smart each episode has a different idea .....,"October 1, 2006 (United States)"
790,10.0,15 March 2022,"We watched a few seasons but super depressing. Everyone is bad or has bad intensions. Dexter is suppose to be pure because he kills bad guys. Lots of coincidences that were nonsense. Like Superman, he was always disappearing when the action took place. We tried to like it and got a few seasons in but it was too depressing for us. Sister was hot but a train wreck.","October 1, 2006 (United States)"
791,10.0,5 September 2012,"The first time I heard about the show from a friend, he said ""Dude, this Dexter guy, he's a serial killer. You'll love him"" and the only response I could give at that time was ""Wait.. The Protagonist is a serial killer! How are they going to justify that?"" The question still hangs in between for me, but that is the intrigue of the show. The show challenges the moral definitions of today's world and shows it from a serial killer's point of view, of how unemotionally and scientifically he sees it and how rational he can make it seem. When a show makes you love a serial killer and hate his victims, there is seriously something to think about. The show is about a person who has surrendered to his inner serial killer and yet tries to fit in the society by observing and trying to behave like others do, and his constant struggle with his ""dark passenger"". Meanwhile the show stays true to its genre as Dexter plays part-detective to search for other killers and play his part in the society. He has the perfect front as the forensic blood work specialist of the police department.

But merely having an intriguing concept does not make a good show, you need to present that concept as well. Fortunately for us, we have Michael C. Hall playing the part who is an absolute delight to watch supported by actors like Jennifer Carpenter, James Remar and David Zayas. The visual effects and the technicality by which Dexter plays cop hooks you to the show. The show never gets old and neither does the character as he overcomes the different challenges in his complicated life.

No wonder the show is running successfully for nearly 7 long years now. It definitely makes it to the top of the list of my favorite TV shows.","October 1, 2006 (United States)"
792,3.0,3 April 2012,"This show is the best show I have ever watched on T.V. Honestly, I haven't not watched a single show that even compares to Dexter. It is very complex and always keeps you on your toes. The plot is always changing and very exciting. People who watch Dexter don't just like Dexter they LOVE Dexter. We Dexter fans are loyal. You will never get bored while watching Dexter because it is not repetitive like some other shows on T.V. The cast is full of a bunch of amazing actor who genuinely convince you of their acting. It's definitely not for the faint of heart as Dexter is a blood spatter analysis as well as murderer. Not to mention the raunchy sex scenes which would not be good for younger children watching. All these things simply add the the thrill of watching the show. So, If you like a sexy keep- you-on-your-toes vigilantly murderer Dexter is for you - no joke. The books are also worth a read.","October 1, 2006 (United States)"
793,10.0,14 August 2020,Dexter is simply the best serie of all time! With the most iconic character in fiction. It's a MUST SEE! for those who like crime/drama series. Especially because we see the entire show in the killer's perspective.,"October 1, 2006 (United States)"
794,9.0,9 February 2019,"Dexter is a guy who has urges You will love his personality through out the seasons I wish I could see more season but sadly it's not gonna happen The serie is the best in its genre This is a Rated R serie It has a lot of blood , black humor and sex scenes Also a lot of adult topics","October 1, 2006 (United States)"
795,10.0,7 May 2018,Absolutely brilliant. A wonderful new look at the crime drama. Addictive. With a controversial ending but it doesn't leave a bitter taste at the end.,"October 1, 2006 (United States)"
796,10.0,29 November 2023,"If anyone hasn't watched it yet, I say for those who have plenty of time during the summer, you can sit down and watch all the seasons. We don't need to look for something else to watch. You will get into the subject from the first episode and you will not understand how the 8 seasons ended. It is a production that combines drama, comedy and detective themes very well. After the series ends, you will realize that something has changed in you. Maybe you will be able to overcome your fears. It's one of those productions that I wish had a sequel. Have a good time everyone. Even though it wasn't a legendary series for me, it was still a gripping season.","October 1, 2006 (United States)"
797,10.0,17 November 2016,"Honestly, I have seen many TV series over the years but none of previous series can be compared to 'Dexter'. At first I thought 'Wow he's narrating his own life? Boring but after third episode, not so boring.

In fact, from the very first episode you know who is who, what their job is, but what Dexter Morgan is? At first he's a mystery. Michael C. Hall (Six Feet Under, Kill Your Darling), Jennifer Carpenter (Quarantine, The Exorcism of Emily Rose), David Zayas (The Following, Bloodline), James Remar (Hawaii-5 O, Grey's Anatomy), C.S. Lee (The Stepford Wives, Chuck), Lauren Velez (Law & Order, How To Get Away with Murder), Desmond Harrington (Dragnet, The Dark Knight Rises), Julie Benz (Supernatural, Defiance, and Hawaii-5 O), and finally Keith Carradine (Criminal Minds, The Californians, NCIS, and Madam Secretary); the whole cast brought the whole book into a live-series 'Darkly Dreaming Dexter' by Jeff Lindsay.

The music, the ambiance, the plots, subplots, the Miami and California background; two cultures merging together, and the guest stars were excellently done by the HBO team. John Dahl, Steve Shill, Keith Gordon, Marcos Siega, Ernest R. Dickerson, Romeo Tirone, Michael Cuesta, Tony Goldwyn, S.J. Clarkson, Jeff Lindsay, James Manos Jr., Drew Greenberg, Daniel Cerone, and many other gifted crew members created something different.

Hopefully, someday the gifted crew members and the talented main cast members may come back; and give us closing episode(s) after the last events on the show, which aired on September 2013. I'm sure there's more to the story and I'm sure that Steve Shill, Jeff Lindsay, Clyde Phillips, and Melissa Greenberg won't disappoint.","October 1, 2006 (United States)"
798,9.0,4 October 2024,,"October 1, 2006 (United States)"
799,10.0,13 August 2024,"Following the misadventures of a boy genius and his annoying sister, Dexter (for the most part) is a bloody masterpiece.

Just the product of a hostile environment, Dexter is a mild mannered blood spatter analyst for Miami Metro Homicide, but in the dark he is a cold blooded murderer. Dexter doesn't want to eat ice cream or play Donkey Kong because tonight's the night for capturing serial killers, sampling their blood, butchering them into pieces, and disposing of them in Biscayne Bay.

The first trinity of seasons are captivating and enthralling, drawing the viewer into the world and mind of a sadistic (yet unintentionally hilarious) psychopath killer. However, it is the fourth season that stands apart as one of the greatest single seasons in the history of television.

Despite the epic beginning, Dexter fails to follow the same code for success throughout the remainder of the series. The thrilling story beats of the latter seasons are spattered with head scratching character arcs (especially for Deb Deb) that will rock you like a hurricane until you're sawing logs.

My recommendation, wrap yourself in plastic and enjoy the ride in the passenger seat because a storm is coming... and his name is Dexter Morgan. 8/10.","October 1, 2006 (United States)"
800,4.0,1 July 2011,"I don't see any comments about Jonny Lee Miller performance as Jordan Chase (Eugene Greer) but I can not get over his American accent. Being British, this is as good as it gets.

Peter Weller did an amazing job as Liddy, I am glad they gave him the chance to show his versatility, the poor guy is only famous for Robocop! He really convinced as a dirty cop, tough and merciless to get his position back.

And by the way, I had never seen Jonny Lee Miller playing a bad guy, but he did a fine job as well. Sober, restraint, repressed and very mean, dominating others to do what he didn't have the courage to do.","October 1, 2006 (United States)"
801,10.0,20 August 2021,"Every season is as good as the previous one, it's just incredible!","October 1, 2006 (United States)"
802,10.0,5 December 2013,"Favorite among the favorites, Dexter is a dear darling of all favorite TV shows. There is no comparison to any show as to how this series is a brilliant and bloody show of all time.

There is a charismatic aura to this monster that you can't help but feel intrigued and fascinated no matter how dangerous he is like a moth to a flame. Every character is vivid and lively and interesting and i don't know how else to describe it other than the word shiny. And the storyline is just brilliant and bloody fantastic.

I didn't start this series until this series was well into it's eight season. And i am glade to have waited it out till it's last otherwise i would not have survived the wait after the end of every season. Probably i would have become Dexter myself just to feel the same excitement as when i watch this show. I have already watched this series like 6 times over and over again. With the end of the series, Dexter has left a big hollow inside me that hungers for just the same bloody brilliant DEXTER.

The most lovable SERIAL KILLER PSYCHOPATH of all time.","October 1, 2006 (United States)"
803,10.0,8 October 2008,"You read the plot and being so judgmental would say that never works for me. How could I possibly get into such a theme? And maybe you insist on it during the few first episodes as well. But by then you've caught on the dark comedy of this show and without caring much for the anti-hero, you follow it with a big grin on your face while sitting back, be it for the sake of the irony of the situation or the witty narration of Michael Hall.

After a few episodes however, you realize you're sitting on the edge of your seat. Lo and behold, you're there. Congratulations! It's frightening how you've started caring about this sweet serial killer with that soothing voice and witty narration.

Perhaps Dexter is a huge leap in neo-noir genre, since here the shadowy and dark persona only is carried through the narration, while we enjoy a colorful cinematography. And it works even better with this huge contrast between shadowy self and brilliant colors of the set.

Engaging, brilliant and easily the best series I've ever seen. 10/10","October 1, 2006 (United States)"
804,10.0,19 December 2006,"I think this was perhaps the best series of 2006. The first episode felt a bit amateurish but something pulled me back in and I watched the second one. After that, I was totally hooked. It just kept getting better and better with a single not-so-good episode somewhere in the second half of the season. I really hope there will be no second season. It would be a pity if they destroyed this like all other good series - beating it to death season by season. Please producers, don't give us another Lost, 24, *insert your favorite never ending series here*.

All in all - Superb!","October 1, 2006 (United States)"
805,10.0,19 January 2009,"I bought my-self season 1 of Dexter as a way of catching up with it as here in the UK we always have to wait till last until all the good TV programmes are shown and not only that but season 2 was hardly out on DVD here. I was pleasantly surprised with my purchase , rather having to stay up till late to enjoy , i got to enjoy it from the comfort of my bed. I think of anyone better than Micheal Hall who plays Dexter , his take on the ice cold serial killer makes him one of the most likable anti-heroes on TV what I really like about him is that there is probably one thing that we can see in there and relate to about him. The comedy is also funny and thats what makes it stand out and thusly makes you want to hook into it every week. Apart Micheal Hall the performances from everyone round are great it shows that the whole crew actually enjoy making the series. Dexter is another great show from the states and I am really looking forward to the next series.

DEXTER : 8.1 OUT OF 10","October 1, 2006 (United States)"
806,8.0,22 September 2024,"After all these good reviews and popping up again and again, I finally started watching this promising show.

Not a fan of the main actor at all, my first minus.

Hearing his thoughts, him talking most of the episodes, feels like a audio book and was getting on my nerves from the start. So I skipped half of the first episode and started the second, hoping the talking was just in the first to explain some things from his past and present, but unfortunately it continued. Why?

Some of his talking was also very ridiculous, like his explanation of perfect driving food - banana and pulled pork sandwich. Nothing smart about that.

At last, I can't find anything interesting in a crime solver/ serial killer. What does that tell you about the people around him?

In short: absolutely not my thing!","October 1, 2006 (United States)"
807,10.0,9 November 2011,"http://www.nnandmr.blogspot.com/

i was searching around the net for someone who can write some real reviews on the show dexter.

I found it!

Go to this guys blog, he reviews mainly TV shows, and i have never read reviews so accurate and detailed! Give it a chance. If you like it, follow the blog, this guy deserves some support!

This guy seems to be just an average person doing what he like to you, there is no way he is getting paid to do any of this. there's no ads. just quality reviews on shows. Give it a look and help him out! This wont disappoint you!","October 1, 2006 (United States)"
808,2.0,9 January 2019,Easily in the top 10 TV shows of all time. Michael C Hall is mesmerising as Dexter Morgan. Jimmy smits as Miguel Prado and John Lithgow as Trinity are two of the best characters of the last 20 years. FACT! Forget that they completely botched the last season. GET IT WATCHED.,"October 1, 2006 (United States)"
809,9.0,14 August 2007,"Rated TV-MA for Violence and Language

I live in Canada so I don't have HBO.However I do have The Movie Network which plays HBO shows such as The Sopranos,Entourage,Brotherhood and a couple of others.Dexter is another good show from HBO.It is a very interesting show about a man who is a forensics specialist by day and a serial-killer by night.Sort of like Patrick Bateman, the main character from the novel and film ""American Psycho"".Unlike Bateman however, Dexter only kills people who deserve to be killed.Dexter also has a girlfriend who used to be abused by her drug addicted ex-husband.His sister also works with him in the police force.There is a character named Seargent Doakes who provides the main comic-relief for the show.Dexter is a very thrilling and entertaining show and If you have not gotten around to watching it, I suggest you do.","October 1, 2006 (United States)"
810,10.0,11 March 2008,"after watching the first episode i was hooked!!! this is probably the best TV show on TV. the plot is well structured and you may well think you know whats going to happen but you probably don't. every time you guess you will probably have guessed wrong.

the show is based around the main character Dexter, who just so happens to be a serial killer and the more you watch the more you realise his points of view (all be them very twisted) but you learn to love the character for who he is and not what he does. he becomes a lovable character even though his ideas on life are not quite what you may expect.

defiantly worth a watch.","October 1, 2006 (United States)"
811,10.0,8 February 2007,"Dexter is great. The acting is superb (with some exception of the sister's character), the plot is great, and if you love bloody gore with an intellectual spin, you'll love this show. Michael C. Hall is just awesome in this roll, and if you like ""Six Feet Under"" then you will probably already love his character in ""Dexter."" I have read the books, and I have to say that the show is far superior to the books. I do think that, after reading the books, it may be worthwhile to wait to read the book until after you see the show. I know, it's opposite of what you might normally think, but I think the show is so much better that the book actually ruins the ideas at times. I can't wait for the next season!","October 1, 2006 (United States)"
812,10.0,31 January 2008,"Dexter works for the police department as a blood splatter specialist by day...and by night, he's a serial killer. And the twist is that he only kills the bad guys. So that makes him a good guy, right? And that's the paradox with Dexter. He is at once likable, lovable, and funny. We're often in his head listening to his monotone and sarcastically witty comments. He knows he's a monster, but we also catch glimpses of his human side. However, the killing he does is graphically violent and disturbing. As much as you like him, you're repulsed by him.

The writing is top notch, and the acting by Michael C. Hall as Dexter is flawless. I originally wasn't interested in this show based on the violence, but I was totally sucked in after watching the first episode.

Dexter currently has two complete seasons and has been renewed for a 3rd season. The show is based on books by Jeff Lindsay. I read the first 3 books---they are good, but the show is actually better. Every episode has me on the edge of the couch. As much as I want Dexter to be all good, it's the dichotomy of good/evil that keeps me coming back for more.","October 1, 2006 (United States)"
813,10.0,8 December 2007,"Amazing show that you just want more and more of. The photo is vivid and the story is great. So high standard all through season 1 and 2. Always a new twist that keeps you totally in trance the whole time. So violently uplifting and warm at the same time. And the humor makes you laugh heavily. It has it all. Together with Twin Peaks, Seinfeld and 24 it belongs in my top 4 television shows at all time. If you thought all serial killing was always wrong, think twice. I hope they continue with more seasons. So genius to come up with the idea of a serial killing comedy drama. And extra credit to the characters Doakes and Batista. Groundbreaking to say the least...","October 1, 2006 (United States)"
814,10.0,31 December 2017,,"October 1, 2006 (United States)"
815,10.0,3 March 2008,"I see a lot of people have already explained the plot, so i won't. I just want to say that I love Dexter.. The story is good, the casting is good, the music is good, I even enjoy the intro. I can't think of anything I dislike.

Friends of mine compare it to American Pshyco, I never got what others thought was so great about American Pshyco, sure it was an enjoyable movie but for me it was nothing more. Dexter on the other hand really hit the spot. Dexter manages to pull of what American Pshyco, in my mind, failed: convince me that one of my co-workers could be a serial killer, and it could even be the nice guy.

This show is smart, fun and I want more! I've seen the first and almost all of the second season. Is there a season three on it's way? I hope so.

I've been a regular visitor on IMDb for many years now and I've never felt the need to give a vote or comment. Dexter changed this. Dexter is the reason I bothered registering and writing my first comment.

Highly recommended!","October 1, 2006 (United States)"
