,Rating,Review_Date,Review,Release_Date
0,10.0,7 November 2006,,"October 1, 2006 (United States)"
1,10.0,14 November 2020,"Thanks to the quarantine, I watched series that I never imagined I would ever see, one of these series Dexter, which I heard had a bad ending, so I decided not to watch it, what a nonsense I missed myself watching one of the best series ever. Dexter has eight seasons and a renewed new season to fix the poor ending and everyone's excited about it. All seasons are excellent, from the first to the seventh, with the exception of the last. You evaluate each season as follows. First 9.7 Second 9.6 Third 8.7 Fourth 9.9 Fifth 9.0 The sixth 8.9 Seventh 9.0 The ex Final season 7.0 Waiting for the new season","October 1, 2006 (United States)"
2,10.0,30 October 2006,"Dexter is the show I have been waiting for my whole television watching life! The complex and damaged characters, the twisted plot line and Dexter's foster dad grooming him, educating him, to make him the perfect avenger,its all so intoxicating! I am breathlessly anticipating the next episode. This show is not only well acted, with each and every main character holding my full attention, but written with such deep intensity that I find it absolutely irresistible! I really find it difficult to wait and see more of how Dex was traumatized as a child, more of Harry's lessons, more of the growing relationship with Rita, more of the ice truck killer, more forensics...More of this great show period. Kudos to all involved...this show will surely be a huge hit!","October 1, 2006 (United States)"
3,10.0,1 October 2006,"I read Lindsay's excellent books - Darkly Dreaming Dexter and Dearly Devoted Dexter - some time ago, and when I heard that there was to be a series based on the books, I was extremely excited. So much so, in fact, that I feared disappointment merely because my standards were so high.

Thankfully, ""Dexter"" absolutely delivers. The show maintains the uncomfortable atmosphere of the novels with better fidelity than one could ever have expected, and Dexter (played by Hall) is all there.

The visual elements from the show are stunning, to say the least. Disturbing, certainly, but more than that - fascinating. Watching the show, it's impossible to keep from finding a certain agreement in oneself for Dexter. He's a monster, and yet it's completely possible to identify with him.

10 out of 10. This one has a permanent spot on my DVR.","October 1, 2006 (United States)"
4,10.0,29 August 2023,"Dexter is absolutely, without a doubt, one of the best shows ever created! It follows Miami PD blood splatter expert Dexter Morgan (Michael C. Hall) as he both solves murders and commits them too. He only murders bad people who've gotten away from the law. Being a blood expert he's able to outmaneuver the police at every turn. It's a thrilling, one of a kind TV show that will keep you at the edge of your seat throughout the entire series. Michael C. Hall is perfect as Dexter and the rest of the supporting cast is just as fantastic! Yes, the ending was terrible but like Game of Thrones, Lost (or any other show with a bad final episode), a few bad episodes at the end doesn't spoil what an overall great show it was and that's what Dexter is...a GREAT show.","October 1, 2006 (United States)"
5,10.0,26 October 2020,Dexter is easily one of my favorite tv shows of all-time and one of the few shows I can watch all the way through several times over without getting bored. It's hard for me to put into words how much I love this show. The only thing that's not good about it is the ending. The ending was pretty bad but that still doesn't take away from how good the show is overall. You should watch this show for Michael C. Hall's performance as Dexter alone. He's amazing in this. If you haven't seen this incredible show yet just make sure you give yourself enough time because you're going to want to binge watch it as fast as you can. Once you start watching you won't be able to stop.,"October 1, 2006 (United States)"
6,10.0,1 October 2006,"Absolutely brilliant. True to Jeff Lindsay's books. The visual contrast between the darkness of Dexter's secret life and and the gloss of Miami adds an almost surreal quality. Character development is right on the money, bringing out the background slowly so one can see the development of Dexter's sociopath personality and his confusion of human behavior compared to his own. Dexter is an actor in his own life; his relationships between co-workers and his personal life are well shown in the video media. The fact that he is a blood splatter expert This is a dark work, but set in the bizarre world of life in Miami is almost believable. Developers of this series should also look to Andrew Vachss's books.","October 1, 2006 (United States)"
7,10.0,22 October 2006,"Dexter, a forensics expert at day, serial killer with a touch of vigilantism at night. Dexter is creating a believable and very detailed portrait of a, lets say troubled, sociopath. One of the parts about the show I like best is the emotions that normal people exhibit, thus forcing Dexter to mimic them. Good laugh when the emotions Dexter fake get real, and he is scared out of his mind, like in the relationship with his ""girlfriend"" Rita, mother of two and victim of her abusive ex-boyfriend. Also liked the acting of Jennifer Carpenter as Dexter's sister Debra, adds a nice touch colour to the show, without drifting into clichés.

Thrilling story, many details, and one of the best opening sequences ever.","October 1, 2006 (United States)"
8,10.0,28 April 2010,"This is going to be my first ever review on IMDb, there is not a day when I do not visit IMDb to check the reviews about movies or TV series that I watch, I watch lots of movies and series.

For the first time in my life it happened to me that I could not sleep after watching a series. I have seen prison break, heroes and a lot other. Prison break and heroes first season was awesome. They inspired me so much that I got some tattoo's done on my body. However both these series cut loose as soon they go to the next season. Heroes was big disappointment but DEXTER.. OMG series after series it starts to make me so curious about the next episode.. damn the season 4. I just could not sleep the whole night after watching it. I spent my weekend watching the episodes back to back.

To start with Dexter (Michael C. Hall) his darkness was off the edge he played the role so well that sometimes I wonder if he is the same in his real life but then I found that Debra Morgan (Jennifer Carpenter) is his real wife who is playing his sister in this series. Damn Debra is one character who is so confused and mostly been controlled by the people around her, she always end up doing something wrong but always gets credit for the good things too.

I love the part when you get to know what is going on in Dexters mind when he thinks about something or when someone is talking to him also the part when he talks to his dead father Harry. (he just thinks what his dad would say in that situation). All the episodes/characters and all the seasons are written and played so well that you can hardly find any flaw in it.

My favorite characters are Dexter (Quite obvious), Rita and Vince Masuka damn Vince is so funny, he just utter one word in his entire episode and comes out to be damn funny.

I just cant wait for the Season 5 and I am sure whosoever watched dexter feels the same way just like I did.

(Apologizes in case my first review has some mistakes and offends somebody's feelings)","October 1, 2006 (United States)"
9,7.0,27 October 2006,"Between Dexter and Weeds, Showtime has a corner on the original new shows market. Not only are both of these shows completely original and innovative, but they are REALLY good.

Dexter, in particular, should not be reviewed by anyone who hasn't seen more than three episodes. I almost feel as if the first episode in the series is a tad-bit melodramatic (note Dexter screaming in the face of his first victim) just to pull in viewers that otherwise need something more visceral than a great screenplay.

By two more episodes the viewer should be absolutely intoxicated by the complexity of the character Dexter and the acting of Michael C. Hall. His own co-stars admit to being almost ""scared"" by how well Hall absorbs his character. Personally, I think that without Hall's mastery of Dexter there would be nothing to watch. Don't get me wrong, the plot of this show is extremely intriguing (and original, to be redundant), but the excitement lies purely in the way Dexter/Hall responds to A) his girlfriend, B) blood, and C) other serial killers.

I think that it is very reasonable to chuckle at Dexter's attempts to ""fit in"" social situations and I believe the writers of this show planned on it. What I am still stuck on, however, is whether or not to cheer Dexter on in his methodology (serial killing serial killers). This had better be the first of many seasons, so spread the word...

...Edit: I watched this series finale last night and come back to this review (which I wrote after the conclusion of Season 1) with my hat in hand to say: ""I'm kind of sorry for the hype.""

If my review was the impetus for your 'Dexter' obsession (I, too, was obsessed) then I owe you an apology for the way it all ended. Sure, sure, I couldn't have known how poorly written the resolution of this once-magnificent series would be. But, you see, I shouted praises for this show from roof-tops...telling every friend who would engage me in discussion about pop-culture that they NEEDED TO WATCH DEXTER, it's the greatest drama on television!

Alas, I will not leave any spoilers here and if you've come along the journey with me then you will undoubtedly watch how it all ends, but I write this edit in vain so that you, internet friend, cannot say that I didn't warn you: 'Dexter' leaves me wanting a real ending.","October 1, 2006 (United States)"
10,10.0,31 December 2014,,"October 1, 2006 (United States)"
11,7.0,13 April 2021,"Hard to believe that Showtime would let a piece of gold turn into a turd after four seasons, but they did. Seasons 1-4 are as good as any show I've ever seen, a solid 10, would recommend to anyone and beg them to watch. Holds up wonderfully even in 2021. Seasons 5,6,7 were not good, but had some good moments. Season 8 is as bad as you will find anywhere. Honestly think it was written by sixth graders, I was begging for it to be over - how the actors could put up with the idiocy is beyond me, but I guess they were being paid plenty by then. If you love the first four seasons, watch the next three and enjoy the characters, then read the spoilers to see how season 8 ends. It will truly leave a bad taste in your mouth if you watch the last season.","October 1, 2006 (United States)"
12,5.0,9 September 2013,"What started out to be a phenomenal series, Is not ending well :(. I crack up weekly at everyone's reviews but never got irritated enough to post my own. Well 8yrs later the day has come this is by far the worst season.... OK sure it has a few highs but far more lows. I love Dex but he is turning into a whiny b**** which defeats the purpose of his original purpose. :/ So there's my rant I wont even get into the others or else I might as well right a report.Wtf is this 10 line crap I see one liners all the time????So they want us to write a whole report. Well this is my 1st review which is obvious at this point lol.So you want 10 lines here is your 10 lines.","October 1, 2006 (United States)"
13,10.0,14 October 2013,"Having watched Dexter right to the bitter end I have to say I won't miss it at all. What was a better than average series, stylishly directed with a great cast was forgiven for being a bit repetitive. It should have ended 3 seasons ago, this last season was pathetic, it was as though the writers had been sacked, some new ones brought in and told to keep it ""ticking over"" and told to end it all in the last 2 episodes. for a show built on secrets very few were revealed, this went out with a pathetic whimper. The penultimate series built to a real dramatic high that promised so much for the final series, instead of keeping this up and pushing the characters to new extremes it was as if they were all too tired to be bothered, every character acted as if they were ready for a retirement home.","October 1, 2006 (United States)"
14,10.0,11 December 2020,"This is undoubtedly, the best ever TV Series I've watched. So addictive, thrilling and entertaining. No boredom, super-fast and it'll glued you to the screen just from the 1st minutes of the 1st episode.","October 1, 2006 (United States)"
15,8.0,13 November 2006,"Although I am not a regular proponent of serial television shows, the eclectic, in-depth storyline and character development in Dexter are far beyond what I expected from Showtime or any network other than HBO. Dexter is a unique insight into the mind of a serial killer protected by his occupation as well as the lessons derived from his father's teachings. By having a resounding premise of catching a notorious serial killer while trying to conceal his own identity, Dexter enters each week with a new sociological dilemma as well as a new criminal to dispatch. What is best about Dexter is his own personal facade of trying to be normal. While other characters in the show are obviously dysfunctional, the audience are privileged to see the flaws of Dexter while people within his own world cannot. Darkly humorous, well-paced, and morbidly addictive Dexter is the best show of 2006, without a doubt.","October 1, 2006 (United States)"
16,10.0,20 July 2023,"In the realm of cinematography and scriptwriting, it is advised to limit character narration allowing actions, conversations, and scenes to speak for themselves. However, if there exists an exception, and it goes by the name, Dexter!

From the start, I found myself captivated by Dexter's character - a dark, introverted individual. The strength of character development was evident, bolstered by impeccable casting and an engaging, crime-filled storyline.

Seasons 1 and 2 stood out exceptionally, earning a commendable rating of 9/10. However, the show's quality began to wane afterward. The introduction of new characters and excessive drama weighed down what was once a classic series. Despite my love for the character, I sensed a gradual decline in its charm, including that of Debra.

The writing and direction were solid, yet Dexter himself stood as the towering centerpiece as his portrayal of dark humor remained a standout aspect. His narration throughout the episodes was a unique perspective where we learnt how he perceived things, people, and crime; it was utterly captivating.

I recommend this series, but I urge viewers to approach it at their own pace and choose the number of seasons to indulge in. However, I must stress that the first two seasons are a must-watch and should not be missed.","October 1, 2006 (United States)"
17,10.0,27 September 2006,"HBO Actors, HBO Directors, HBO Writers, and Showtime's willingness to take risks that HBO might not see as profitable these days (Carnivale + Deadwood R.I.P.) make for a killer combination in ""Dexter,"" the new Sho Comedy/Drama about a Serial Killer Killing Serial Killer (you read right). In my opinion, Showtime has always had a hard time producing an original series that's truly original and good, so it's incredibly refreshing to see the network pull such a ""Hail Mary"" move and come out on top. ""Dexter"" is, without spoiling anything, an excellent vehicle for Michael C. Hall, and explores the inner monologue of a Serial Killer in a way that has never been approached before without seeming too predictable or hokey. Watch it and you will not be disappointed. You'll even want to watch the next episode, which says a lot considering the network. I just hope they don't screw it up.","October 1, 2006 (United States)"
18,10.0,14 October 2020,New season 2021 confirmed. They say its limited. Let's pray otherwise. I'm so excited!!!,"October 1, 2006 (United States)"
19,7.0,27 December 2020,"Over the past couple of years I have gone through some of TV's most followed series of recent years (Breaking Bad, Lost, Fargo, etc.). I've LOVED it: the great storylines, character progression, scenes that make your jaw literally drop. That being said, the TV series Dexter is my favorite, and it's not close. Never have I been so emotionally attached to something on the television. My mind literally correlates memories and relationships made during that time to where I was at in the series at the time. I finished the show in 4 months, and let me tell ya, it was on my mind the entire time, throughout the entirety of the day. I loathed daily responsibilities that took away Dexter's screen time (very unhealthy looking back, not that I could help it). One year after finishing the show, Dexter still crosses mind on a regular basis (one example: me writing this review at nearly 3am in the morning lol). And oh my am I looking forward to the reboot next fall!

One request: please please please do not be turned off by all of the negative reviews about its ""tragic"" ending!! Everyone wanted their own perfect ending (impossible), but what the producers put together is perfectly on brand with the 8-season storyline that precedes it. I have to believe true Dexter fans understand this!","October 1, 2006 (United States)"
20,10.0,21 January 2015,,"October 1, 2006 (United States)"
21,7.0,25 October 2006,"Dexter is hilarious; it is easily the best new show on TV! Dark, dry humor crops up in the most unexpected places, and the settings and dialogue are laced with CSI's pseudo-scientific appeal. While the show may appear to treat standard morality as irreverent, it is actually an excellent study of humanity at its best -- and worse.

The character of Dexter, a disassociated, psychopathic serial killer, is somewhat reminiscent of Data, the android in the Star Trek series. Dexter is devoid of normal, human emotion, and has to learn behaviors by rote. Seeing the world through his eyes enables us to closely examine what is ""right"" and what is ""wrong."" We have to pause and wonder about our own perception of reality.

Overall, the show is a side-splitting outlet for the vigilante/serial killer/dysfunctional being in all of us. Well done!","October 1, 2006 (United States)"
22,4.0,9 November 2019,,"October 1, 2006 (United States)"
23,10.0,20 October 2020,,"October 1, 2006 (United States)"
24,9.0,9 October 2013,,"October 1, 2006 (United States)"
25,9.0,13 September 2020,"I'm here in 2020 to remind everyone to watch Dexter at least once in their lives. There are very few shows I circle back to once I've experienced the conclusion, but I still cannot get enough of Dexter. Every time through I experience another ""oh damn"" moment that I didn't catch the first time around. This keeps me in constant fascination of how brilliantly woven and expertly portrayed this story is. The writing is superb and you will never get ahead of the twists and turns.

Did you ever think you'd have empathy for a serial killer? Me either...

Watch it. Trust me.","October 1, 2006 (United States)"
26,10.0,23 October 2006,"After four episodes, I'm ready to proclaim this the best show currently on TV, one that may someday rank with the likes of _The Sopranos_ and the first season of _Twin Peaks_ as a contender for the second best TV show ever (after the incomparable _Buffy the Vampire Slayer_; one of the show's producers and writers is former Buffy writer Drew Z. Greenberg, and the cast includes Buffy / Angel mainstay Julie Benz).

Dexter is a sociopath, someone with no human feelings and hence no natural, inner moral compass, and he has an unquenchable blood lust that drives him to kill. But he had the great grace to have been the adopted child of a police officer, who (as we see in terrific flashbacks) successfully instilled in him a complete moral code, which he adheres to on a strictly intellectual level. This is an utterly brilliant concept (which I assume derives from the novels it's based on), one that allows the writers to explore the nature of moral behavior and of what it means to be human (Dexter is, in a sense, an alien).

Another thing the show is doing brilliantly is moving at different speeds in parallel. There is a primary apparent season-long story arc (concerning a cat-and-mouse game between Dexter and a serial killer), and a a secondary arc involving Dexter's sister's police career. The first handful of episodes include a very powerful completed arc concerning one of Dexter's police colleagues and a local crime lord, while two of the four episodes so far have also included a self-contained story spliced among (and playing off) the ongoing ones. I've seen the future of TV season structuring, and this is it.

While the writing isn't quite up to the brilliance of the best of _House_, it's been excellent. The cast and production are terrific. The only reason you wouldn't want to watch this utterly brilliant show is the frequent use of extremely graphic images: there have probably been more severed body parts shown in these first four episodes than in the first four episodes of every other TV show on the air combined. If you can stomach that, tune it for a mesmerizing look at what makes us human -- or inhuman.","October 1, 2006 (United States)"
27,10.0,26 October 2020,"Despite being so many seasons, no one gonna feel bored or detached. Impressive and outstanding series.","October 1, 2006 (United States)"
28,10.0,10 March 2011,"I've just seen the finale of season 5 of Dexter and man...! What a series! This is writing at his best! I just love Michael C. Hall plays his part. His does it so well, it completely let you forget that he played the role of David in Six Feet Under (my favorite of all time-series!). And all the characters in the five seasons are really wonderful, but I especially liked Julia Stiles. She's playing her part very nice!! Lithgow in season 4 does his part only as he can do and it works fine for me! Can't wait 'till he returns! (he must return!!) Here in Holland ""Dexter"" airs on a non-commercial canal en mostly about 23.00 h. at night. Nobody in Holland heard of this series, unless they watch in online or on DVD. And that's a pity... I can't wait until season 6.... Keep on the good work!","October 1, 2006 (United States)"
29,7.0,11 January 2022,Best show ever. Loved everything about the ending because we knew Dexter was going to control his dark passenger. NEW BLOOD SUCKS. Don't watch it because you'll be more grateful for this ending.,"October 1, 2006 (United States)"
30,10.0,19 October 2020,"Keeping it short,

You're getting a serial killer who's made to kill evil.

You'll love him and weirdly you'll be able to relate to him. Odd eh?

Enjoy (ps watch out for Easter Eggs in the background of scenes secretly placed)","October 1, 2006 (United States)"
31,7.0,15 October 2021,"Back then Dexter was a really nice surprise and for quite some time one of my favorite shows. Yes, the last two seasons did not hold the level of quality (at least that's my opinion) and the ending was a rather disappointing (but nevertheless a heart breaking) one but anyway - if you like (to watch, I should add) serial killers, Dexter belongs on your menu, no doubt here.","October 1, 2006 (United States)"
32,1.0,15 October 2020,I just finished watching this series and today I heard they're dropping a new limited series! I.cant.wait!!! Especially if it's anything like the last few seasons.,"October 1, 2006 (United States)"
33,10.0,6 August 2024,I think dexter is the best serial killer TV show ever yet it had one of the worst endings in TV shows and i think the ending would have been better and there were a whole lot of ways for a good ending or even an enjoyable ending but there isn't. But i do think that the characters in this TV show were pretty good yet we see a lot of death in their development and i think that these deaths make more suspense but i don't think that all the characters that died in this TV show (important characters) is necessary because the ending came with a death of a really important character and thats one of the reasons that makes this ending one of the worst. But overall i think this series would take seven stars because of the characters and their development and even the whole idea of the series it's indeed iconic.,"October 1, 2006 (United States)"
34,10.0,2 July 2020,,"October 1, 2006 (United States)"
35,10.0,10 May 2014,,"October 1, 2006 (United States)"
