,Rating,Review_Date,Review,Release_Date
266,7.0,16 April 2013,"The plot lines are ridiculous. The acting is mostly pathetic (Debra, ugh). Many of the characters are annoying (Debra, ugh), and I am glad when one gets culled from the herd. I have watched through season six, and my opinion has not changed (although, Debra's acting has improved somewhat). It is more of an assessment of the obvious than an opinion. But I keep watching. Why? I love the character (and actor) of Dexter. It is worth watching just for him. And since there is only about six to eight episodes per year (as opposed to Lost, for instance, which had 20-30 episodes a year), I am willing to waste that amount of time. I watch an entire season (either by renting or streaming)in a couple of sittings, which makes it more bearable.","October 1, 2006 (United States)"
267,10.0,3 March 2020,This is one of the best shows I've ever watched. Maybe better than Breaking Bad! Atleast I enjoyed it more than Breaking Bad. Watch this if you haven't cause it is a bloody masterpiece. The ending is bad though but still...,"October 1, 2006 (United States)"
268,6.0,28 September 2020,One of the best series I have ever seen. It's so addictive. Every episode is a gem. & Michael??? Superb. Just awesome.,"October 1, 2006 (United States)"
269,5.0,11 June 2016,,"October 1, 2006 (United States)"
270,9.0,15 May 2020,"This show is much better than Breaking Bad from the acting to the story, how i wish to watch another show similar to this one.","October 1, 2006 (United States)"
271,9.0,2 September 2020,"This show is awesome and strange. I think they did really good. I would hope that if there was a spin off it would be just as good. The directing was awesome. The plots were awesome. And, hopefully Michael C. Hall makes another show or movie with a similar character. Everything took me by surprise. Highly recommended. I love what I saw. My mom and I are both huge fans. And, she and my stepdad both watched all of them with me. And, we were all laughing and crying at all the same stuff. And, we had discussions about some of the cases.","October 1, 2006 (United States)"
272,8.0,9 May 2021,"The focus of this story is very original and very well directed. The characters are bright, funny and engaging. It's one of those series that we can't stop watching until it's over. However, I didn't like the ending. It could be a little more detailed, explaining that I could continue with Dexter's son.","October 1, 2006 (United States)"
273,10.0,26 September 2009,I never read the books and wasn't into the Dexter craze during the first three seasons. One thing I love about deployments to the gulf is the chance to watch shows I never got the chance to see before. I watched the first season of Dexter which was the only season available to me and I am HOOKED! I am fascinated by the originality of the plots week by week. No other show can seriously compare to this one. I cheer for Dexter and Harry's Code more and more with every episode I watch. I can't wait for Season 4 to kick off. The fact that this show is on Showtime is great so the rules of cable TV do not apply. This show is the only reason I even subscribe to the channels.,"October 1, 2006 (United States)"
274,10.0,18 December 2020,"The early seasons of Dexter were some of the freshest and most exciting television I have seen. Wonderfully dry yet absolutely horrifying and asks moral questions of the viewer throughout. The Trinity Killer was a particularly frightening villain. As with most show, Dexter drags on way too long and the characters are squeezed inside out.","October 1, 2006 (United States)"
275,10.0,1 August 2020,"I may aswell say now, the end of season 8 was handled badly, no way to end this great show. However I refuse to downgrade my score from a 10 as overall this was a superb production.

I cannot believe I never got round to watching this before now, but better late than never. It's fantastic, it really is completely absorbing, go watch it...","October 1, 2006 (United States)"
276,7.0,24 May 2024,,"October 1, 2006 (United States)"
277,9.0,22 March 2012,,"October 1, 2006 (United States)"
278,7.0,3 April 2021,"Story is good. The direction is decent. Background music is really nice. Acting is from top top drawer.

BUT, THERE ARE GHOSTS IN THE STORY WHO EAT WITH THE REAL CHARACTERS, WHO TRAVEL AND DO ALL THE STUFF THAT REAL CHARACTERS DO.","October 1, 2006 (United States)"
279,2.0,25 August 2022,"Not even the ending can spoil this series for me michael was impeccable as dexter, the cast has a lot of chemistry, the cinematography is great the writing and plot are sharp and very well constructed.","October 1, 2006 (United States)"
280,9.0,11 February 2016,,"October 1, 2006 (United States)"
281,10.0,29 December 2018,"Want to erase my memory and watch it again,,,,,,,,","October 1, 2006 (United States)"
282,10.0,14 April 2011,,"October 1, 2006 (United States)"
283,9.0,2 March 2023,"8.7????? It's a 10!!!!! Dexter is seriously the best thing I've ever seen on TV, ,along with Breaking Bad.... brilliant writing, superb Characters, if you haven't seen it you simply haven't lived.

C. Hall plays the part to perfection, he owns the role and if I'm honest I couldn't think of anyone else who could play this part. You simply fall in Love with every character and the stories just get Better. From the word go you're instantly hooked and every Day you'll find yourself wanting more, constantly tuning into Dexter's world, the blood spatter Sociopath everyone loves. Beware all Killers and murderers, be afraid!! Be very afraid!!! Driving around late at night in downtown Miami isn't safe anymore, unless, of course you want to end up gagged, unconscious wrapped up in plastic lying on a table in a darkened room awakening to the sound of a drill, knowing you! Are the next victim of Dexter Morgan.","October 1, 2006 (United States)"
284,9.0,24 December 2014,"I started watching this show last year. The show was intriguing. A story about a serial killer who worked as a forensics expert was such an amazing plot line and seeing what sort of adventures Dexter got into was great. I was instantly hooked from season 1. However, unfortunately, the writing slowly disintegrated as the series continued. If you want to see the best of Dexter, I suggest watching up to season 4. After season 4, the writing gets poor, and the plot line becomes pretty terrible. I will say that season 4 is definitely the best season of the show, and has the best villain of the entire show, and quite possibly, one of the greatest television villains of all time. Season 1 was great because it was the origin of Dexter and introducing us to him. Season 2 was also really great as well. Seasons 3 and 5 were OK but I wasn't super fond of the villains. Season 6 was pretty bad. The writing was just awful, and you could tell that the writers didn't really care nearly as much as before. Season 7 was also quite terrible all culminating to the all too famous Dexter ending that made many fans angry. The ending provided absolutely no closure, and made no sense. It felt like the writers just gave up on the show and threw something together at the last minute. This was definitely disappointing.

As for acting, it was pretty good for the most part. However, I still think Deb is the most annoying TV character of all time. She was just so annoying and stupid so many times in the show. Laguerta was also really annoying and moronic as well. Other than those two, the acting was great all around. The sex scenes were also awesome. There were some real hotties on the show like Aimee Garcia and Yvonne Strahovski.

Overall, this was a decent show. However, up till season 4, this show was definitely a 9 stars. However, seasons 5-7 kinda lowered the rating, and made this show a 7.","October 1, 2006 (United States)"
285,10.0,6 November 2021,"Might not be a popular opinion but I really don't like Debra as a character. Her attitude, her pouting whenever she doesn't get her way, the way she talks and her actions. Her judgements towards stuff she doesn't like or agree with. She's a whiny spoiled know it all. Her facial expressions when she's talking and smugness is what really gets me. But Jennifer Carpenter as an actress absolutely killed it, if an actor/actress can make someone feel as I do towards Deb than they did an outstanding job and couldn't have done any better. I literally cannot stand her. And with every watch is gets worse. She's so whiny, such a cry baby. Makes stupid Pouty faces like she's a child not getting there way. But mostly it's her stupid facial expressions.","October 1, 2006 (United States)"
286,7.0,19 September 2021,"I was a late comer to this show but that's fine as I get to watch all seasons without having to wait bonus.

It has a different take on most crime dramas which makes a nice change and am sure like many viewers they warm to Dexter as a modern day vigilante as such whom kills bad evil people . I am currently on season 4 and have found the series very entertaining and addictive.

On season 5 and the show is beginning to slip. I find it hard to accept that Dexter starts as a very precise serial killer both in planning and excution and by season 5 he has become sloppy to the point of assisting a victim not only find and kill her abusers but he moves her in to the home that he lived in with his wife and family! That for me was unacceptable as Commonsense would tell you that is a dumb idea if you want to stay under a radar and not draw any unnecessary questions there were hints of this in season 4 when he befriends the trinity killers family which to me was so absurd given his job and the fact he made no attempt to disguise his appearance not what you would expect from the character that was portrayed from the first season.

All in all I would say the first 4 seasons good after that not as good. Have to mention this end of season 5 and Dexter is still wearing the same brown grandad shirt and combats that he has worn since season 1 surely wardrobe was not that strapped for cash that they could only provide one set of clothes for him? It's not like they are the regular black clothing you would expect if committing crimes to make you less obvious.

Season 7 and the wheels have definitely come off the bus Dexter has a killer on the table and just in act of what he does he changes his mind doesn't kill them but has sex with them instead I mean WTF and here we go again another killer love interest zzzzzzzzzzzzz it's been fun but all good things come to an end and this ended 2seasons ago for me.","October 1, 2006 (United States)"
287,10.0,9 January 2009,"Dexter is yet another one of those shows that has so much hype spread over it, it can but fail to deliver.

Dexter is devoted to getting good press and good reviews, not to getting good audience numbers or subscribers to Showtime.

In other words, it's pretentious, forced, silly and more than a little annoying for anyone not into trying to appear ""cool"" to their friends in the media.

Dexter is also failing miserably to build an audience, despite Showtime's repeated efforts at promoting it.

Maybe it's not getting audiences because it's really not a good show.","October 1, 2006 (United States)"
288,6.0,17 February 2023,"Read Lindsay's excellent books - Darkly Dreaming Dexter and Dearly Devoted Dexter - some time ago, and when I heard that there was to be a series based on the books, I was extremely excited. So much so, in fact, that I feared disappointment merely because my standards were so high.

Thankfully, ""Dexter"" absolutely delivers. The show maintains the uncomfortable atmosphere of the novels with better fidelity than one could ever have expected, and Dexter (played by Hall) is all there.

The visual elements from the show are stunning, to say the least. Disturbing, certainly, but more than that - fascinating. Watching the show, it's impossible to keep from finding a certain agreement in oneself for Dexter. He's a monster, and yet it's completely possible to identify with him.

10 out of 10. This one has a permanent spot.","October 1, 2006 (United States)"
289,2.0,11 February 2022,"Dexter is a very well written show. It is no doubt a violent show with a lot of crime. So, not everybody likes it.

It stands out for making the viewer sit on the edge of their seats, anticipating twists and turns and get rewarded by great reveals.

The most beautiful thing about the show is that the narrator/protagonist is a anti-hero type character constantly justifying his horrible actions yet the viewer can see right through the intentions of a horrible mind.

Michael C Hall is on spot during the entire show's run, truly deserving the praise he receives. His exceptional acting, great narration is just about enough to follow this show.

Supporting cast is excellent and uplifts the entire show to a different level, especially John Lithgow(Trinity Killer). All supporting actors make a place in out mind.

The show is at its best during the first four seasons followed by a mediocre final 4 seasons and a really bad ending.

Overall, Dexter will be in my list of top 10 TV shows.","October 1, 2006 (United States)"
290,10.0,8 February 2022,"The writing is incredible, the casting is beyond reproach. Great cinematography. Great direction...

But honestly, if you love Dexter...then you have your own demons. This story, this character...swings hard at the audience's vices. Are you an alcoholic? A junkie? Sex Addict? Perhaps you have a sociopathic need to collect stamps? Dexter is a parallel you... His actions and his reasoning are that of an addict.

Every step of the way, I fully understood him and his reasoning. I'm an addict. Booze, sex, video games, TV, movies, books, work, collecting, smoking, music...everything I've ever loved in my life - I've gone too far, too extreme...too much. ""Tonight's the night.""

Dexter is an amalgamation for Americans with insatiable appetites - we just want more of what we love. We are not concerned with the cost, we'll fix that later... We just want more. Always.

Brilliant show. Brilliant cast. Brilliant writing.","October 1, 2006 (United States)"
291,10.0,14 April 2024,"I watched Dexter as an avid fan when it was first released. The very nature of the series seemed to draw me in, as to my knowledge, there had never been anything like it on TV before.

I gave a very detailed review on the series finale, which could have been coupled into a series review, but I prefer to take a different approach here.

When delivering a series like Dexter, where the core fundamentals is/are the evolutionary process of the main character; someone (sic)escaping immense trauma; constantly running but always out of breath. Its an exercise in near impossibility.

Unless every viewer is completely jaded or living in denial themselves, this might be one of the great character studies of our time.

Comparible only to the brilliant work of Vince Gilligan with Walter White as the focal point. I've yet to see anyone come even remotely close to character development than that of Dexter Morgan. (Nobody will ever top Bryan Cranston as W. W., it just can't be done)

Showtime's series' often circulate around this very theme. Hank Moody, Jackie Peyton and just about every character on Shameless are good examples.

Hank Moody might be the closest. A guy who can't get out of his own way for being himself. Breaking the self-destructive pattern and to not relentlessly give in to your inhibitions can be affinitively relayed to that of Dexter Morgan.

The entire series of Dexter is his inability to change despite a willingness. A battle from within, a tense slow-slow-burn that never changes mood and plays out like a Nirvana song.

The characters take on a life of their own. In a show where the focal character seems devoid of life, there is so much of it going on around him; innevitably his humanity reaches beyond his bubble. The horrific fear of the unknkown and the potential beauty & anger that lies outside/within.

Erik King as Sgt. Doakes and Jennifer Carpenter as Debra Morgan are the two that really tie things in at the beginning. One loves Dexter, the other hates him. Yet they are partners and they together, are fantastic. Both on screen and as characters. There's an almost peace you find between them which is annoyingly comfortable (just great writing, in a nutshell)

There's a ceetain beauty that eclipses everything in a doom & gloom reality.

In a quick summary of the seasons (no spoilers here but I will reveal cast members)

Seasons 1 & 2 are pretty much, roll with the punches. Chaos. See what life is like from the other side. Jaime Murray gives us a solid juxtaposition with her potrayal of Lila, the batsht crazy companion.

Season 3, Jimmy Smits delivers a very strong and overbearing performance. I mean that in a good way. It shows us that contrast which is desperately needed; in order for us to truly value Dexter as a person.

Season 4 brings us a hauntingly fantastic performance from John Lithgow, and is hands down the best season of the series. Almost humanises the worst in the people. The exploration of mental health, a recurring theme in this series.

Season 5 just gets darker, which after the previous season you didn't think was possible. Even further character advancement, its like watching real life. Ironic since most reality tv is scripted. Tons of great guest stars in this one from Maria Doyle Kennedy, Johnny Lee Miller, Peter Weller & Julia Stiles are with us for just the right amount of time.

Season 6, speaking of mental health and people being with us for the right time. An entire cornucopia of guest stars in this season. From the enigmatic sincerity of MOS (Yasiin Bey, aka MosDef) Edward James Olmos and Colin Hanks amongst others.

This season is just dark... plain and simple. Dark.

Season 7 brings darkness in the light. It really advances where we are with Dexter and you truly have to review the previous 6 seasons to see who he is now from who he was, as this ties in greatly with...

Season 8, the... not so grand finale. I only say that because there was a spinoff series. The ending is mired in, not controversy, but tears. Tears from all the people crying and complaining about the ending. Which was beautifully done, but this is Dexter so you know, if you expect a happy ending from a show about a serial killer, you yourself might be a sociopath.

There are great performances all around and even returning characters that all play a hand in Dexters development. Some truly solid perfomances turned in by: Margot Martindale, Yvonne Strahovsky, Geoff Pierson & Keith Carradine.

There is a lot of emotion in this show which is constantly circulating around death and murder. They take you down the darkest roads and then show you the light, but the light is only light where darkness exists, and believe me, there is much of this series without light.

It is graphic and omits nothing. All I can say is don't expect anything. Don't expect the unexpected. The audacity of thinking that you can get inside the head of one Dexter Morgan, that's an exercise in futility.

Truly one of the great shows of our time. It'll get under your skin, for better or for worse. Undoubtedly you will be left feeling something in the end, and all the way through.

This is not your typical cop drama by a long shot. Matter of fact, the crime/police-procedural aspect takes a back seat to a much larger story.

Life.... of a serial killer.

Entertainment Value 8/10 Overall Rating 9/10

As the seasons go on towards the end, the editing does get a little sloppy. However, if you were a serial killer trying to break the habit, you would have a lot of push & pull, the hesitancy which is reflected in the writing. Make no mistake, this is no mistake.

Yes, it can be annoying, but if you really want to analyse everything this isn't the show for you. You'll also realise by the time you start complaining about that, you will have been a hypocrite for watching the show that long.

Trust me, save the complaints and just watch. There's a symphony of events and you come to realise you are the one viewing things from the mind of Dexter Morgan. Don't lose sight of that or you miss the point of the entire series.

Otherwise a fantastic watch and with a second viewing, a decade+ after the show ended, and it still holds up.","October 1, 2006 (United States)"
292,8.0,22 June 2024,"I am glad I gave this show a chance. It is very suspenseful, calculated, and full of laughs and excitement. Dexter is likeable, although you want to hate him. Although I can not condone his behavior, I can understand his motives behind them. The more episodes I watch, the more hidden ""treasures"" I find. If you like suspenseful, thrilling, and exciting entertainment, then this is the show for you. The characters bring a level of humor and intrigue to this drama. After watching the first episode, I was hooked! You will not be disappointed if you give this show a chance. It has become one of my favorite dramas.","October 1, 2006 (United States)"
293,9.0,29 October 2021,,"October 1, 2006 (United States)"
294,10.0,14 October 2014,"If you have Netflix and you haven't watched Dexter, what are you waiting for? Dexter is my personal favorite television series to date (and yes, I have watched breaking bad). I watched Dexter on Netflix earlier this year and it only took me about three months to finish because of how awesome it is.

Don't worry, no spoilers here, just an abstract to get you hooked in case you don't know what the show is about. So basically Dexter Morgan is a blood spatter analyst for Miami Metro, but by night, his 'dark passenger' must be fed. To fulfill his needs he has to take lives. In order to do this while not ruining the lives of innocent families, he takes the lives of others who have killed.

If the premise alone isn't enough to excite you, I must also say, this show is very addicting. Once you finish season one you may not want to stop.

I highly advise every human being who does not think that a show with killing is satanic, to watch this show.","October 1, 2006 (United States)"
295,8.0,29 June 2014,"I gotta start off by saying the first season of this show is one of the best first seasons I have ever seen in any show. Dexter starts off with a bang. I mean we all like the vigilante superheroes. And when that superhero is a nut like Dexter it makes it much better. So like I said that first season was awesome and the second season was not far behind. This show will get you hooked from the start no doubt. But like with most other reviewers have said it does go downhill. As the show progresses and the characters evolve Dexter turns more humanLike. His sister which at the beginning her character was great but after a few seasons her character ias eratic and goes all over the place I'm talking all over the board here. To make a long story short the beginning of the show is amazing, it will get you hooked no doubt about it. The problem is this show definitely goes downhill. Every next season is not as good as the one before and by the time you get to the last season you just want to finish to show off, you're t not even looking forward to the next episode you just want the show to end already and each episode is harder and harder to watch. It turns into a chore. My opinion is do not watch the season 1 or any of this show whatsoever. Just not worth it in the end. Great first season though. My opinion is you get stoned as hell and watch the first two seasons and then u should dump the show. Peace out fellow stoners...","October 1, 2006 (United States)"
296,6.0,21 August 2022,,"October 1, 2006 (United States)"
297,6.0,5 August 2019,"When I started the series I was like ""this is exactly the show I always wanted to see"". It had very good sense of humor and every character was written so well. Every season this was getting worse. The story always keeps in the same way, I was almost never surprised about what is going to happen next. First two seasons 8-9/10 Rest between 3 and 5","October 1, 2006 (United States)"
298,4.0,3 December 2012,"I usually go by IMDb ratings to pick what to watch. When something has a score of 9+, it tends to be really good. But this.. well, it isn't.

There is no suspense, no intrigue, no clever plot. Worst of all the main character is completely unbelievable as someone who at the same time is a sociopath that feels no emotions whatsoever, and yet only tries to do the ""right thing"" by killing ""bad guys"". It doesn't make a lot of sense and the constant and tiresome voice over acting tries to sell this as layered somehow, but it just doesn't work; its not a intriguing multi faceted character, its an obvious and transparent attempt by the script writers to make an empty emotionless sociopath somehow more ""likable"". Well, I didn't like him. And not because he is a sociopath killer, there are plenty of sociopath movie characters I did like.

The other characters are better described as caricatures.

Perhaps its unfair to judge this series after seeing all 5 seasons of ""the wire"", which did live up to its score; the concept of Dexter had promise; a serial killer leading a double life could have made for a very interesting series, but this is just boring.

Don't be fooled by the score. I know I was.","October 1, 2006 (United States)"
