,Rating,Review_Date,Review,Release_Date
168,8.0,17 August 2024,"I love the chemistry between will smith and martin lawrence. I hope they always continue with the franchise when they can. Will smith for me is one of the best actors

When their late police captain gets linked to drug cartels, wisecracking Miami cops Mike Lowrey and Marcus Burnett embark on a dangerous mission to clear his name.

When their late police captain gets linked to drug cartels, wisecracking Miami cops Mike Lowrey and Marcus Burnett embark on a dangerous mission to clear his name.

When their late police captain gets linked to drug cartels, wisecracking Miami cops Mike Lowrey and Marcus Burnett embark on a dangerous mission to clear his name.","June 7, 2024 (United States)"
169,9.0,13 August 2024,"Oh, Chitty, Chitty, Bang, Bang - we're back baby.

Mike and Marcus have to clear their late Captain's name because they think he was framed as being connected to the cartel. They sort of need Mike's terrorist son Armando, who assassinated their Captain, to get out of jail in order to accomplish this.

The chemistry is fully back. The humour is back. The great script is back. Plenty of high action, gun chases and explosions as per to keep you happy.

By far, this is my favourite Bad Boys movie, yep even better than the first.

One thing that concerned me was Martin Lawrence, in some spots throughout, but particularly in the last scene at the barbecue. He looks as if he's not doing great, it's in his eyes, sometimes the speech is a bit slurred etc. Something ain't right is all, but still a great movie.

Loved the development of the character, now Marcus' son in law, Reggie. A real star turn.","June 7, 2024 (United States)"
170,9.0,10 August 2024,I cannot remember the last time I've had this much fun. It is just a good old action movie. Is it formulaic. Yes. But. It works. It has a bit of feels to it as well. Martin and Will do an amazing job. The movie knows what it is and it stays true to that. Strong male as well as female characters. Great arch's that get completed. All the actors do a great job of filling in their roles. No subversion or anyone doing what they normally wouldn't. It completes the bad boys story in a great way. It would be fun to see the story continued with martins son and maybe the rest of the younger ones including Mike's son. It is a fun ride.,"June 7, 2024 (United States)"
171,9.0,2 August 2024,"So the concept is long in the tooth and there are zero surprise but the movie provided much needed fun mixed with some impressive action. Bad Boys: Ride or Die reunites the stellar duo, Will Smith and Martin Lawrence back on screen. After a very long time, these guys still have the same wit and energy. The same chaotic drive we got from the 1995 debut. It's amazing keeping up such a pace and standard.

There is enough laughter to go around for everyone because like always, Marcus (Martin Lawrence) brought much humour to the table with his death syndrome admidst the entire action scenes. That's one of the layers I enjoy about this franchise, outside of the crimes, top action sequences, human frailties, they still manage to throw in some comedy.","June 7, 2024 (United States)"
172,10.0,24 June 2024,"I'm shocked this is the highest rated of the 4, to me the original Micheal Bay films were best but this was a lot of fun and worthy of praise! The comedy was great although more action and story focused than on the comedy; the action sequences were so satisfying. One of the best aspects is the spiritual quotes, Martin Lawerence and Will Smith are treasures the last few decades they are magnificent even their cheesy films are great in my opinion. I think it's genius how Reggie's character has gotten better since Boy Boys II and interesting how this has a lot to do with what it's like being old. Love these movies a lot - highly recommend.","June 7, 2024 (United States)"
173,10.0,21 June 2024,"It could be whatever you want, but this action/comedy genre film is for those times that you can spend laughing with your friends or just for your own pleasure, go see something that has 2 favorite genres of the people although it is far from being almost perfect but it is a perfect comedy which is its strong point. And bring back the cast of Will Smith and Martin Lawrence for another adventure, if you see this it will make you laugh apart from pleasing you as a viewer and it would be ideal for a good weekend With your partner and friends to feel what it's like to be bad boys forever God this is beautiful.","June 7, 2024 (United States)"
174,10.0,20 June 2024,"In the latest installment of the ""Bad Boys"" franchise, ""Bad Boys 4,"" the dynamic duo of Will Smith and Martin Lawrence once again graces the screen with their undeniable chemistry. While the film leans more towards comedy than its predecessors, it manages to strike a balance between action-packed sequences and emotional depth.

The exploration of the relationship between Will Smith's character and his son adds a layer of complexity to the story. We witness heartfelt moments that resonate beyond the adrenaline-fueled car chases and explosive gunfights. It's refreshing to see these tough-as-nails detectives confront their vulnerabilities and navigate family dynamics.

However, the real scene-stealer is the enigmatic character Regie. With just a mere 2-3 minutes of screen time, Regie leaves an indelible mark on the audience. His mysterious aura and unexpected actions keep viewers guessing, and his impact reverberates throughout the entire movie.

""Bad Boys 4"" delivers the perfect blend of action, comedy, and genuine emotion, making it a must-watch for fans of the franchise and newcomers alike.","June 7, 2024 (United States)"
175,10.0,19 June 2024,"Great fun - laugh out loud funny in places! Great action scenes and a bit cheesy in places, as always. A good sound track too which we booped along to all the way home!

We weren't as much of a fan of the third movie, as the first two are so high on our favourites list, but this was an amazing come back!

Overall we loved it and will definitely buy the dvd when it comes out to add to the bad boys collection.

If you like the other films, you'll love this, as there are lots of nods to the previous ones (but equally you don't have to have seen the others to ""get"" what's going on).

Brilliant film!","June 7, 2024 (United States)"
176,9.0,19 June 2024,"Of all the Bad Boys Movies, I enjoyed this one the most. Just seeing Martin Lawrence and Will Smith back again was quite entertaining. Martin Lawrence is hilarious, and their chemistry is royal. Several cameos made the movie even more fun. The movie house was packed, and there were no empty seats, even for a matinee. I believe Martin did this movie for Will because they are close friends. I didn't want to say anything besides my sister, and I thought it was great. It is pretty suspenseful and thrilling. Some scenes have you clutching your armrest and rooting for Will and Martin. The situation that they got themselves in called for the Bad Boys.. The exciting part was that Martin became spiritual, and that carried him through the movie. I would suggest not relying on the critics and seeing the film yourself.","June 7, 2024 (United States)"
177,8.0,17 June 2024,"This movie is hilarious action packed and overall just a fun time! I watched this in IMAX and I'm glad I did the action in this movie is unique and fun! And the elements in this movie are so much more different from any of the other bad boys movies. There is a new spiritual element one of the characters go threw that I think is handled pretty good, and the will smith and Martin Lawrence are are the best they've been in the franchise and they are just hilarious. And reggie gets one of the best scenes in the movie. This movie is just a love letter to all of the bad boys fans and is a treat for all audiences.","June 7, 2024 (United States)"
178,9.0,17 June 2024,"I really love Martin and Wll's chemistry as well known actors! This movie is by far a must see, I love the fact that they stick with the storyline and that they have not only have brothhood but they are both humorous. From beginning to the end this movie was good, I am so looking forward to re-watching Bad Boys 1 through 3 all over again. I've always been a Bad Boys fan and this movie definitely did not disappoint. Great come back Will & Martin, I took my husband to see this movie for father's day and the movie theater was packed and filled with laughter. I won't spoil it but definitely a must see.","June 7, 2024 (United States)"
179,7.0,13 June 2024,"Go see this movie! Seriously, go see it.

I have to say, my anticipation was low for this movie. I went simply because I had seen the others and was curious. A bit of a nostalgic throwback. I so thoroughly enjoyed myself. The movie pace was excellent. The throwback/callback moments were beautiful. I laughed so hard so many times. I enjoyed the heartfelt moments. The plot was solid, true to all of the other films. The action sequences were incredible, interesting, and different. The directors did an amazing job bring a mew perspective to a shot out sequence. Because it's the fourth film, it's easy to say it's contrite. But it's because it's the fourth film, you enjoy the references to the other film. You are along for the ride, yet again, with your old friends, the Bad Boys.","June 7, 2024 (United States)"
180,7.0,12 June 2024,"Great movie! Action packed and fit in nicely with the franchise. You start to worry when a franchise just goes on and on...but not with this one. Will and Martin make it enjoyable to go to the movies each time they share the screen. I was glad to see the writing wasn't forced and the script fit in nicely after the last installment. I hope they continue to make a few more because we all know we need good laughs. Once again, the action and special effects are great. My only complaint would be to make sure they don't get too unrealistic like the Fast and Furious franchise did over the years. Bad Boys is a must see for fans!","June 7, 2024 (United States)"
181,7.0,10 June 2024,"Will Smith and Martin Lawrence are the box office magnets Hollywood forgot about. Time and Time again Will smith has proven how he can appeal to the masses when he presents his talents on the silver screen, but Hollywood has chosen to narrow its focus on trash that no one is interested in seeing. I could continue analyzing this failure to launch behavior, but why waste the time, energy and intelligence trying to convince Hollywood that when you release trash at the box office the films fail to produce a profit. Will Smith and many other talented actors and actresses are the ticket to re-energizing Hollywood. There are some extremely good writers and an equal amount of gifted directors and editors out there just waiting for Hollywood to wake up and smell the coffee. And that is the tip of the iceberg when it comes to producing a successful well acted movie it requires thousands of support staff and specialist to create the final product. I am talking about wardrobe specialist, special effects masters, carpenters, mechanics, camera specialist, etc. And never forget the stand-ins stunt doubles. So while Will Smith and Martin Lawrence and company count the money and receive all the glory, maybe some idiot in Hollywood will have an epiphany and realize the public like guns, justifiable violence, some anger, lots of good lines for the actors to recite and most importantly professional Actors and Actresses. Way to Go Smith and Lawrence!","June 7, 2024 (United States)"
182,1.0,9 June 2024,"**Comedy Gold: A Fun Ride with Bad Boys**

I recently watched ""Bad Boys"" and absolutely loved the comedy aspect of the movie more than the action. The performances by Will Smith and Martin Lawrence were excellent, bringing a lot of energy and humor to their roles. Their chemistry on screen is undeniable, and they deliver countless laugh-out-loud moments that make the film a joy to watch. However, I felt the supporting cast didn't quite measure up to the main duo's level, which slightly detracted from the overall experience.

The plot, while somewhat predictable, is carried by the strong performances and witty banter between the two leads. The action scenes are well-executed, but it's the comedic moments that truly shine and set this movie apart. My favorite part was the hilarious interactions between the two leads, which kept me entertained from start to finish.

Overall, ""Bad Boys"" is a highly entertaining film, especially for those who enjoy a good laugh. It's a perfect blend of comedy and action, with a dynamic duo that makes the movie unforgettable. Definitely worth a watch if you're looking for a fun and engaging film!

---","June 7, 2024 (United States)"
183,1.0,9 June 2024,"I sneaked out of family duty to watch this one.

No regrets total worth the guilt!!!!

The dynamics between will and Martin are so natural you feel they are like that in real life. As a father I also related to Will's father-son scenes, excellent play on both Gen-X and Gen-Z audience.

Would have given it a higher score but I was expecting a better soundtrack. I feel like the generation balance the director managed to achieve with the new actors added to the cast didn't make it through to the soundtrack, it felt scarce with a slight disappointment every time a track is played.

Never the less, good watch, action filled , fast paced and nostalgic. Loved it!","June 7, 2024 (United States)"
184,6.0,8 June 2024,"Bad Boys Ride or Die is funny enough to give it a try. Marcus saves the movie with his comedy and a good script. It gave me different times a good laugh. Furthermore, there is enough action and a decent story line. The co actors around the duo were decent and gave the movie some extra dialoge.

However, i do think Will Smith is getting a little bit to old to act as the tough 'bad boy'. After the golden globes it seems he is trying to get some positive repution back. Thats maybe also why marcus is more in the lead character then Will. But if there is a 5th, give him a more supervisior rol with comedy or something.

Bad -> will Smits Son, was he afraid to talk?

All by all, still a 7 out of 10. Mostly because of Marcus who gave me some laughs.","June 7, 2024 (United States)"
185,8.0,16 September 2024,The last movie in this franchise was terrible and I never thought it could get any worse and believed the end was then. So when they came out with this one the expectations were pretty low. They should have ended this series after the second movie which was average at best. This is a far cry from the first movie and has to be one of the worst movies I've ever seen and I have watched over four thousand movies at least. I honestly can't even think of one good thing to say about this movie other than I hope they never make another one. I can't believe as of right now it's rated a 6.5. Anything below that and I don't even give it a shot so I watched this one. Don't wast your time.,"June 7, 2024 (United States)"
186,5.0,1 September 2024,"The only thing more disappointing than this movie, was the fact I watched the whole thing.

From the bizzare LSD type dream death rubbish, to Lawrences acting actually getting worse, then the padding of the dialogue with the leads singing bad boys to each other, and stupid POV shooter camera angles; this film should never have been made or released.

The only thing it does is end the franchise for good. Will Smith is not on many call sheets after the slap, so you'd think he would have taken better care of his existing franchise that he could fall back on. Can only think he'll do another MIB movie now.","June 7, 2024 (United States)"
187,8.0,3 August 2024,"I enjoyed this film, but it's starting to get a little Fast and Furiousy.

There is one scene, which is the best scene of the movie and it involves Reggie. Reggie earned a whole 2 stars for this film.

Otherwise, the humour at times didn't land and the action, while good, just seemed pretty standard.

I like the direction they took with the story and the acting was good; I feel like Martin Lawrence is about at the point where he can't keep up with his costars, but I still liked him.

Overall, it's nothing fantastic and you don't really miss much.

Also there's an after credits scene that I hope no one stayed back for.","June 7, 2024 (United States)"
188,8.0,1 August 2024,"Story : In a word, amazing The screenplay is very good. There is no boring scene. Full on action, comedy, masala movie.

Special scene : It is worth remembering whenever the comedy scenes come. Seeing those scenes gives a lot of laughs.

Many thanks to the director Adil & Bilall for making such a movie.

The performance of both the Will Smith and Martin Lawrence, is amazing. They appeared in all action scenes comedy scenes. Gave everyone a lot of laughs. Everyone was very impressed.

Movie length : Perfect length Adults will laugh and gobble up the movie. Very good movie. There is no boring scene. If a good time is to be spent then there can be no other option than watching this movie.","June 7, 2024 (United States)"
189,7.0,30 July 2024,"Bad Boys for Life was the biggest grossing film of 2020. Mainly because all movie theatres closed down in March of that year because of the Covid pandemic.

Directors Adil El Arbi and Bilall Fallah return to the franchise in this noisy but empty movie.

Mike Lowery (Will Smith) and Marcus Burnett (Martin Lawrence) are now fifty something detectives at the Miami Police Department. Mike has just got married and Marcus has a heart attack where he has visions of their former boss. The late Captain Howard (Joe Pantoliano) who gives Marcus a cryptic warning.

Soon concocted evidence emerges that Captain Howard was crooked. Only both Mike and Marcus find themselves on the run along with Mike's convict son when they tried to clear the Captain's name.

It seems Captain Howard had uncovered police corruption and links to the cartels when he was alive.

There are some good action sequences, some comedy but the plot is lame and forgettable. Even the casting of one performer gave the corrupt cop away.","June 7, 2024 (United States)"
190,10.0,25 July 2024,"I've seen all the bad boys films, I liked this one, martin lawrence was very funny, he really was the star of this film, i thought #3 was'nt that great really, but this made up for it. I laughed out loud probably every 10 mins at martins crazy lines and total seriousnes about it lol, but i thought it could of done with some quieter moments, for just 10 mins ? I'm pretty sure bad boys 1,2 , had those moments, I do think number 1 was my favourite......thats how you drive. The moments with reggie were funny too, hes a badass, dont forget that. It made me want to watch all the previous movies again, I just might.","June 7, 2024 (United States)"
191,10.0,23 July 2024,"I really, really like this franchise, so I am really glad that the latest Bad Boys movie did not disappoint. This is not a sellout, it is at least on par with the others in the series, both actionwise and storywise. I'm happy that the people behind the film have managed to keep the relatively simple premise and progression as a good classic actionfilm must have. These days, it's easy to overcomplicate things, but they don't do it here.

Also, this is probably Martin Lawrences best performance across all the films in the series. He is incredibly funny, especially at the beginning of the movie..","June 7, 2024 (United States)"
192,10.0,15 July 2024,"This is the type of movie you can watch when you just want to have a good time. It does not have the best writing, but that's obviously also not the movie's goal.

There is lots of action and mostly good jokes. One of my favorite things about this movie: It doesn't unnecessarily drag out the final conflict and there's not a single moment when it's boring, since there's always something going on.

The main character's energy matches in a way that makes their dynamic very fun to watch. I'd say you can easily watch this movie without having watched the others, but that's not a bad thing.

I just wish for one thing: that this will be the last Bad Boys movie. It'd be a good fit for a conclusion of the story.","June 7, 2024 (United States)"
193,9.0,8 July 2024,"Cinema is back. This is an amazing move that I cannot wait to watch a few more times. The jokes and the chemistry between the actors was wow. Will Smith and Martin are the perfect team. Will Smith will always remain my favorite actor. I don't think I can say enough about this amazing piece of art. Please go watch it, you will enjoy it and will have a great time. The story line was also stellar. This movie again is a masterpiece and I enjoy every moment and I wanted to see more. The action scene were also great. I want to go see it a few more times. This movie is the movie of the year in my opinion.","June 7, 2024 (United States)"
194,10.0,6 July 2024,"Bad Boys: Ride or Die continues with the adventures of Mike Lowrey(Will Smith) & Marcus Burnett(Martin Lawrence). Our beloved Bad Boys return with the classic mix of action & comedy but, there's a catch. This time, Mike & Marcus, two of Miami's finest police officers, are on the run.

Bad Boys: Ride or Die is an awe-inspiring film. Returning directors Adil El Arbi & Bilall Fallah have given us a movie that is action-packed, hilarious & overall, an out-and-out entertainer. In fact, Bad Boys: Ride or Die is the best in the franchise, surpassing Bad Boys for Life(2020), Bad Boys II(2003) & even the near-perfect Bad Boys(1995). The action set pieces are mind-blowing. The visual effects are flawless. The comedic scenes will make you guffaw raucously. The cinematography by Robrecht Heyvaert is superb & makes you feel like you're a part of the action. Will Smith is spectacular as Mike Lowrey. Martin Lawrence steals the show as Marcus Burnett. Lawrence's no holds barred performance is the highlight of the film. Vanessa Hudgens & Alexander Ludwig are awesome as Kelly & Dorn, respectively. Paola Nunez, Eric Dane, Ioan Gruffudd, Jacob Scipio, Melanie Liburd, Rhea Seehorn, Joe Pantoliano, Dennis Greene & Quinn Hemphill are fantastic as Rita, McGrath, Lockwood, Armando, Christine, Judy, Captain Howard, Reggie & Callie, respectively. The supporting cast is unforgettable. Bad Boys: Ride or Die is a must watch for fans of the Bad Boys franchise. Watch it on the big screen & have an absolute blast!","June 7, 2024 (United States)"
195,10.0,1 July 2024,"(SPOILERS ALERT) Now let me get this straight, I'm ultimately rating this movie as a movie of it's genre and not exactly as a movie no matter any circumstances. As a movie it objectively deserves an 8.5, but this movie has to be one of the best of it's kind. The action was amazing (might even be in the level of movies like the man from Toronto and Central Intelligence which definitely are known for their amazing action) and it sometimes made you even forget that you are watching a kind of comedy. The humor was good and was not overused or underused. The script/plot was generic but honestly it might be the only characteristic of the movie that's a bit cliche (you know the whole kidnapping the protagonsist's wife and hunting them etc.) and we should also remember that the film's genre is a genre that focuses on the viewer having fun and only that. No one expects Daniel Day-acts nor Christopher Nolan-plots. It is a very nice movie that's worth the 2 hours and the 8-10 euros/dollars. Absolutely recommended for people that are comedy fans but also people that either haven't seen any Bad Boys movie (like me, although I will definitely watch the older movies of the frnachise sometime) or don't really like this type of action movies.","June 7, 2024 (United States)"
196,9.0,21 June 2024,"Martin Lawrence and Will Smith still have the chemistry like they did when they the first Bad Boys, and although they are not as young as they once were they magic is still there.

Mike and Marcus discover that evidence has link to their deceased mentor captain, saying he was involved with a petty criminal. Both set out to prove he is innocent, but both become marked for death, will they be able will to stay alive?

Still enjoyable like the last one, the actors playing the bad guys are also good. Action scenes are also great, keeps you the edge of your seat. I was wondering is Lawrence and Smith scenes where improvised.","June 7, 2024 (United States)"
197,9.0,19 June 2024,"Our favorite Bad Boys Will Smith and Martin Lawrence have really hit it out of the park as usual, and they're still good at their age with their perfect style of combining action, comedy and drama in the fourth installment of the Bad Boys franchise. Directors Adil and Bilall did a fantastic job just like in the previous movie, as they gave movie-goers large doses of thrills and laughs in every scene from the beginning until the end, as well as paying homage to the original films. Bad Boys: Ride or Die is a guarantee that you'll have lots of fun this summer at the movies and it's worth the price of admission.","June 7, 2024 (United States)"
198,7.0,18 June 2024,"This piece is a great cinema work! The movie is interesting, funny, light, full of action, adrenaline and comes with amazing thematics (life, family, brotherhood, principles and justice). All cast is amazing and even better than the prior movie! Special congrats to Will, Martin and Jacob S2!

Is for the family to watch together! Loved seeing the 4th movie in cinema, it is just a good experience.

I was hoping to see som pos credits to give us a glimpse of what comes next, but not this time; and that is ok. Great job!

PS: Martin, I love you man, you're so funny rs! Will, great come back, you're very talented man! And Jacob, oh man you're amazing in this one!","June 7, 2024 (United States)"
