,Rating,Review_Date,Review,Release_Date
0,8.0,5 June 2024,"So I was left a little disappointed after the last film, something just seemed to be missing but this really hit the spot.

The 2 central characters still have great chemistry, but this felt a lot more like an ensemble piece with more fleshed out characters around them. I'm just going say #Reggierocks.

Some great cinematography with lots of fab camera and drone work zooming around all over the place. The first person gun work at one point added a new dimension.

Miami looks beautiful with the Orange and Teal tones.

Action galore and a good protagonist in Eric Dane, although his motive and why he is doing what he is, was pretty rubbish, but he still played it well, and to be fair you don't come in to this sort of film hoping for Shakespeare level story telling.

Some fun cameos pop up which raise a smile.

The soundtrack is good and Lorne Balfe delivers on the orchestrated score.

It has all you would expect from a Michael Bay production. Definitely life still in the franchise.","June 7, 2024 (United States)"
1,7.0,6 June 2024,"I do not understand why some people are still at this ""Will Smith"" slap stage. Just get over with it. You don't give 1/10 to a movie like this unless you're dumb and got shot in the head. Yes what he did was bad, but it has nothing to do with the movie nor his actions, cuz remember he's an actor. Remember all these people giving 1/10 are still but*hurt about the slap & are trying to boycott Will Smith for his acting career. I don't want to include any spoilers, The movie is funny got great comedy lines, great acting and the jokes are just too funny so don't lurk around giving weird unrealistic rating just because you don't like the actor in real life. & i'd suggest to watch it for fun.","June 7, 2024 (United States)"
2,9.0,5 June 2024,"I have always been a fan of will and Martin ever since the fresh prince and Martin show. This movie was so fun, I laughed so hard and the audience in general too. Action packed and some scenes were shot in a way I never saw. Congrats to the filmmakers adil and Bilal which are from my city Brussels in Belgium. They gave their own twist and flair to this and the last bad boys and I hope they keep coming. I watched the premiere 2nd of June and now I'm re watching the old ones. Probably my favourite action series.

Also regi is the goat ðŸ˜‚ annd I love how Martin is more like the badass this time anround, he did a great job. Again, this movie is awesome and I will be watching it many more times.","June 7, 2024 (United States)"
3,8.0,5 June 2024,"The fourth entry in the revitalised buddy cop, action, comedy franchise. Bad Boys: Ride or Die sees wisecracking Miami cops Mike Lowrey (Will Smith) and Marcus Burnett (Martin Lawrence) embark on a dangerous mission to clear the name of their late police captain when he gets linked to drug cartels.

Firstly, they missed a trick not calling this instalment Bad Boys 4 Life, alas we cannot have everything we desire. Anyway, it was inevitable that we were going to get a fourth (and potentially fifth) as 2020's actual Bad Boys For Life made nearly half a billion dollars and due to the pandemic, was in the top 3 highest grossing of that year.

It has been too long since I watched the first film (it is long, long overdue a rewatch), however Bad Boys II I return to every couple of years when I require a dousing of Bayhem. Has it aged well? Nope. Is it obnoxious and overlong? Yes. Does the action rule? Hell yes! The third film I found solid, yet disappointing, it lacked the grit and sleaze of its predecessor and incorporated a bizarre supernatural element that didn't quite click.

This was a real step up from three and balances the slick, modernised lega-sequel of the previous film with the sleaze and chaos of Bay's entries. Admittedly it's a little bit of a rushed and rocky start and narratively the film isn't bringing anything particularly new to the table, yet it's clearly relishing its heightened mid-00's vibes. Once Marcus returns a from death's embrace with a new outlook on life and spirituality and Mike's fears for his family, his own mortality and a reconnection with his fugitive son come to the forefront of his anxieties, the film adds a surprising layer of character work that still manages to incorporate dick jokes and f-bombs aplenty.

Action-wise this boasts some of the franchise's best set pieces. Director's Adil El Arbi & Bilall Fallah certainly lean a bit heavier into the Bayism's here than in BBFL. A slow-motion, sped up and gloriously chaotic digital, neon tinged art exhibition shootout is very Bay. A superb John Wick-esque home invasion shootout (featuring a well deserved triumphant moment for a fan favourite character) and the *entire* finale section of the film is a bar setter for shootouts this year. The incorporation of first person POVs, drones, alligators, explosions aplenty mix together for a riotous bloody blowout.

Performance-wise this was certainly the best way Will Smith could properly return after the Oscars controversy (I know he had Emancipation a few months after the incident, but I don't think anybody apart from me watched it). His more vulnerable and subdued fatherly moments as Mike are well executed... as well as the kick ass swagger that established the character. However, it's Martin Lawrence that steals the show. A motormouth, wide-eyed, born again foul mouthed spiritual guide who claims he can't die. He's having a ball and both he and Smith's chemistry is still unbeatable. Supporting players Jacob Scipio, Ioan Gruffudd, Rhea Seehorn and Reggie himself Dennis Greene are all locked in to the material.

Bad Boys: Ride or Die was a bullet riddled, cackle worthy blast of throwback fun that was a step up from my expectations. Smith & Lawrence are still a great duo, the action is killer and the balance of soap opera sincerity and over-the-top drama balances effectively with the motor-mouthed bickering and gags. Sure, the plot isn't particularly standout and the film is a little choppy in the first act, but when the wheels begin to fully spin, the film charges off the start line.","June 7, 2024 (United States)"
4,7.0,7 June 2024,"Terrible acting, bad storyline and absolutely not funny (although, they try). Obviously someone needed the money and Hollywood is out of fresh ideas.

Only a few actors should act in action movies beyond a certain age and the sad boys aren't amongst them.

Not sure, if part III or part IV is worse, but both are not worth watching at all.

From here onwards, I can ot tell you anything anymore about this bad movie, but I need to fill the minimum characters. Interesting fact: there were 6 people in the cinema watching this movie. On a friday evening. I guess a lot of people were smarter than us 6nand didn't even go into the movie.","June 7, 2024 (United States)"
5,8.0,5 June 2024,"It must be a lot of fun to write these 'Bad Boys' movies. The two lead characters really are great and they play off each other so well. And even if you wrote something in the script that was so-so, you know you've got a couple of great actors who will make it work. There were a couple of lines in this movie where I thought to myself, on paper that probably wasn't all that funny, but they found a delivery that got a chuckle out of me.

There's everything you could want out of a 'Bad Boys' movie in this one. The action is there, the laughs are there, there's a great menacing villain and there are some fun side characters to help carry the load. We are four movies into the series and have yet to see a drop-off in standard whatsoever. Bring on the next one I say. 8.5/10.","June 7, 2024 (United States)"
6,9.0,7 June 2024,"Watched it in Imax in Manchester Vue and it has to be one of the worst written movies i have watched in a few years , sad to see better action flicked movies get bombed like Furiosa ,watched that last week and man what a movie that was after fury road. This movie is worse is many ways compared to For Life.

Hopefully this will bomb bad as Fall guy and all too coz this isn't any better than any of those dumb action flicks. Go watch Furiosa guys and do that after watching Mad Max Fury Road, just a recommendation to you'll, and you'll will love it for sure.

Now all we wait is for Deadpool and Wolverine hopefully that wouldn't disappoint like so many others this year man.","June 7, 2024 (United States)"
7,4.0,9 June 2024,Movies was unbelievable from start to finish. Definitely was the best of all 4 films!!! Anyone rating it under a 7 is Definitely a rating killer. I'm very hard on rating movies! I'm against all cheesy films! I will not go to the movies if the film is a below 7!! I cried laughed throughout this movie! I didn't go watch any of the previous bad boy films in theaters. This one is a must see!! Don't listen to these people who rated the new mad max film a 7 or 8.... please dont!!! I didn't expect the movie to move me the way it did... Sheeesh! I watched it in Dolby and felt even bit of action in this film. MUST SEE!!!,"June 7, 2024 (United States)"
8,10.0,11 June 2024,"I loved the first two and felt like the third was very, very off tone and out of place for the ""trilogy"". If like me you disliked the third, you will hate for forth. Where the third introduced this bazaar soap opera styled movie with a witch and a long lost son, this one they introduce.... god? And soul mates..... its funny I completely missed the warlock and demons in the first and second film.

I genuinely hope this movie makes enough money to fund a 5th film just so they can afford Michael bay and some decent writers! Because I love seeing Will and Martin together and the characters (at least the OG version of them were so great). Why have they made Marcus SOOO dumb... it didn't work for Thor love and thunder and it doesn't work here.

The directors need to quit and just work for MTV it's genuinely like they have never seen the first two films and have only HEARD about Bay's style of directing. Just because you can fit a camera in a seemingly impossible position doesn't mean you should do it every 3 minutes. Every shot and scene in this film is just flooding with an attempt to be stylish or cool or bay-esc. The camera is constantly spinning or moving it makes Bay's shaky cam feel like a tripod. Also what's with ALL the colour/neon!? Every close up I swear has either a red, green or purple glow to it; unless it's interior, in which case you are treated to over the top lens flare from curtain less windows. The OG films looked beautiful but also had some grit to them.

Point is I am a fan so wanted to like it but it didn't look good, it wasn't funny and it just felt like the franchise is going the same direction as fast and the furious but some how less entertaining.

The last two films have been a crime to cinema, how they got Will and Martin to sign their contracts I will never know.

How two thirds of this film was ever put on the page, I will never know. It felt like a straight to DVD waste of time.","June 7, 2024 (United States)"
9,8.0,5 June 2024,"This truly was the best in series. Loved all the action sequences, great acting, great writing and great directing! This really is a movie that should be enjoyed on a big screen to experience it in full force.

Furthermore, the chemistry between Will Smith and Martin Lawrence is highly entertaining and makes the movie fly by.

What I also appreciated is the press tour and how Will Smith and Martin Lawrence actually seem to be really good friends which definitely adds to the experience and one can see that in the movie.

Go in, have fun - in this day and age we need to stop pointing out the flaws but to go in and enjoy. This is entertainment after all!","June 7, 2024 (United States)"
10,3.0,5 June 2024,"Bad Boys is back and it's so much fun, action packed and hilarious! More Martin Lawrence than the last one had which I really loved cause he was hilarious in this one too and so many types of jokes in this! Martin also had a really funny shootout scene involving food. Action was badass with the great choreography the last one had and more of that brutality too with bloody heavy hitting scenes, one scene I thought I was watching John Wick! There is probably one scene I wasn't keen on which is when someone has an out of body death experience, didn't match the grounded story. But the rest of the story was thrilling and connected to all the past bad boys films which I can appreciate it more for that, especially seeing the relationship between Mike and his son. Mike had some more character work with his panic attacks and even Marcus showing age and toll of the job they do. Final showdown was epic with tons of action with some really unique stuff to have fun with. Music they used too was really epic of course ""Bad Boys"" song but the song ""Tonight"" was really awesome and the use of those songs made it so much more amazing! Some really interesting camera angles especially during the final face off and as a wannabe cinematographer I appreciate them trying new things and seeing them work. It's good to see actors such as Rhea Seehorn, Eric Dane and Ioan Gruffudd in more roles too! There is also a Michael Bay cameo which was pretty cool! A great Bad Boys film that is epic on scale, hilarious and action packed fun!","June 7, 2024 (United States)"
11,5.0,12 July 2024,"I was a huge fan of the first two movies, at the time there was a lot more buddy comedy action films back then and these were up their with the best of them, rewatched both over the years. The third was ok, not great and not particularly memorable, I was kinda surprised they did another but I think the reason is pretty simple... Will Smiths popularity and reputation took a huge hit for a long while and this being one of his most popular franchises was more likely than a geriatric fresh prince.

I for one was a huge will smith fan from awful movies like WWW to his music and tv but last 6-8 years I've found I've gone off him and his style a lot and this film really drove home stuff I don't like, the endless shots of him pulling faces, the fact he has to be the hero, talking down to others, his character is not likeable, Lawrence is near 60 with endless hair dye doing the same stuff as when he was mid thirties, it felt forced and a bit tired to me. I didn't find any of the healthy living jokes that funny.

I found the young generation saved this film from being a walkout for me, the couple, the son and son in law were great, especially the son, the scenes were great with him in, he was very believable. One thing that bugged me was that the ""good guys"" fall into an animal enclosure and think it's ok after winding it up to attack the animal. Hardly standard good guy behaviour.

Story was ok, but far fetched and lame but that fits in with this maybe being forced out, who knows, but either way as a stand alone film it's probably quite entertaining and watchable but for a fan of the series and 2 actors I've enjoyed a lot this didn't land.","June 7, 2024 (United States)"
12,7.0,27 July 2024,"I'm not understanding all these good reviews on here? I LOVED the first two, liked the 3rd one, but have recently grew more attached to the 3rd one as of lately. However, this one, what a major disappointment. It seemed like they had a set amount of days to make this movie with a set amount of money to spend for the movie. It literally was not like ANY of the other 3. The action was scenes were abysmal, their usually funny and perfect timed humor was nowhere to be found. Thinking the funniest part of this movie was the very end with Reggie. I'm hoping that this movie will be like the 3rd and grow on me. Oh and not to mention, the casting was awful! I LOVED the captain, he was the 3rd most loved person in all 3 movies, next to Mike and Marcus. I love the idea of the daughter to avenge his death, however, the casting of his daughter in this movie was an awful choice. I just felt her acting was pitiful. I'm not sure what happened to Michael Bay/ Jerry Bruckheimer making this movie, but my thumbs up are for the first 3 and a thumbs down for the 4th.","June 7, 2024 (United States)"
13,1.0,6 June 2024,"Bad Boys: Ride or Die is a fun-fight entertainer with a predicted storyline. It would be incorrect to categorize this film as awful. Let's talk about it using the key components of a movie.

Direction: Not too awful. It might have been better with more information regarding the character development, scene continuity, actor dialogue modulations, and setting.

Plot: The plot of this film is weak. There are no enhancements over any of the prior stories or materials, and the plot itself is not new.

Screenplay: It appears that there is no need to rewrite the screenplay for this film. It may have changed places, attire, and other equipment from the original script.

Dialogue: The dialogue in this film is informal and typical given the circumstances. A portion of them are useless.

Cinematography: This film emphasizes the use of cameras. Particularly in the action scenes. Not that awful, actually.

Acting: Will's entertaining dialogues aren't all that memorable, and his acting is lifeless. Several times, Martin has overacted. That could be the characterization, I don't know. However, something is absent.

Editing: The hue and lighting aren't very appealing. VFX and blue screen are provided as usual. For the huge screen, some effects are quite unique. It's interesting to watch fight scenes with musical accompaniment.

Stunt: As long as there is minimal usage of blue screens, the stunts in this film are good.

Soundtrack: It's alright. The stunt scenes' background music is well-done.

Attraction: To put it simply, the Bad Boys movie's entertainment value is ""okay."" It is not a thrilling, suspenseful action film. A typical action movie, nothing noteworthy to say.","June 7, 2024 (United States)"
14,1.0,6 June 2024,"That's not to say this franchise has overstayed its welcome, no. But this movie feels like it has exhausted its last bit of entertainment without coming across as unnecessary. And that's a good thing.

Out of the four Bad Boys movies so far, this was probably the one I enjoyed the most. It maybe also has to do with the fact that this was the first Bad Boys movie I've watched in the big screen, naturally making the experience more exciting and memorable, but I also feel like the movie has a lot to make it likeable - be it the rather clichÃ© but effective script, the callbacks, the action, the excitement and most of all, the amazing chemistry between Will Smith and Martin Lawrence.

Overall, the movie is pretty fun and while not all jokes land, it's still decently funny and entertaining at the same time.","June 7, 2024 (United States)"
15,2.0,11 June 2024,"Hollywood can't make movies anymore. So they make pretend movies, that is movies that just runs without any goal, story, entertainment value or respect for their audience.

This is one of those pretend movies.

So... what do we get for our hard earned money? No much, to be honest. We get a couple of bad actors that tries to be funna (fail), that try to be cool (fail), and that try to make talk about old age and at the same time doing the things they did in the former movies (fail).

The problem is that even the camera work and directing are bad. And why use shaky cameras that just make it even harder to watch this money grab? Well I guess someone is laughing all the way to the bank - unfortunately it's not the viewer. Give this one a pass.","June 7, 2024 (United States)"
16,10.0,7 June 2024,"They should have put Chris Rock in this movie and have him kick the s. Out of Will

i feel that would have saved will career.

And would be ok with everyone

they missed an upportunety here.

The movie is good.

Decent even

decent acting some parts are creative

but anything with will right now is bound to fail.

Them choosing ti go to cinena first instead of releasing it on netflix was a mistake it will flunk on the cinema office obvioaly that will just send a message that to not put will in cinema now.

They should have released it in netflix .

In anyway it will come to netflix within a month o assume.

This is a good movie to watch in netflix not good enough for cinema and if you wait just a few weeks it will be in netflix where much more people will upvote it and like it.

It is cute though to see Will Bots that he paid a lot of money for giving this movie 10 stars chatgpt reviews

.downvoting every negative review.

And against them.the real people giving this movie a 1...

its a cute battle.

Just wait until it comes to netflix guys.

It wouldnt take long.","June 7, 2024 (United States)"
17,3.0,8 June 2024,"I'm shocked people liked this. I think it's one of the most miserable things I've seen at the cinema in a good while. Bad Boys: Ride or Die tries to convince you it's trying hard, but I wasn't fooled. It's free of anything edgy, radical, daring, or provocative, even though it stylistically feels like it's insisting it is those things. A few blood spurts and some swearing (not nearly as much as earlier movies, from what I can tell) can't fool me. It feels like it goes out of its way to avoid racy humor, has one scene with racists but feels afraid to make them genuinely racist, and refuses to punch up or down with its humor. I just wanted it to pick a direction, even if it meant a film feeling lowbrow or mean-spirited. At least it would be something. Comedically, this is so flat, uninspired, predictable, and corny. I laughed more at the film than I laughed with it, and I barely ever laughed at it to begin with.

The film makes baffling decisions about where to take the two main characters and then never explores those things in interesting ways (sudden panic attacks for one, and a near-death experience in the film's opening moments for the other). There are so many side characters and they're all less interesting than Smith and Lawrence, and those two are already going through the motions here (there are crumbs of chemistry between the two still, here and there, but it's slight). The supporting cast just overwhelms in the back half, once or twice to the point where I briefly forgot this was a Bad Boys film.

It doesn't live up to the title the way you'd want or expect. There is nothing Bad in a good way here; it's just Bad in a Bad way. There's nothing by way of attitude, spark, life, or guts. It's a cowardly, flat, monotonous, cynical, ugly, boring, and woefully lacking film. I hated it. The only thing that saves it from a 1/10 is the fact there were some explosions and brief moments of camerawork in the climax that looked kind of cool. I guess Smith and Lawrence could've been worse, too. They're phoning it in, but they phone it in better than anyone else in the film. It's abhorrent and soul-sucking cinema.","June 7, 2024 (United States)"
18,6.0,6 June 2024,"Full of energy, laughter, and non stop action was really good seeing it on the big screen! I cannot tell you enough how much I enjoyed it

I enjoy all of the movies will smith is in, he's a brilliant actor along with Martin Lawrence, and bad reviews left on here are nothing to do with the actual film, will smith knew what he did was wrong many people make mistakes does that mean there life should be nothing anymore? And stopping doing what they enjoy and working and living their life.

I will forever like will smith and watch any movie he is in

Must watch honestly you will not regret it

Fab film!!!","June 7, 2024 (United States)"
19,8.0,23 July 2024,"Bad Boys: Ride or Die

Oh dear, I had hoped that at the end of the last banal movie we had seen the end of this excruciating franchise. How much macho posturing can we, the viewer, be subjected to that literarily made me squirm from one scene to another.

Not only was there a vestigial script, nasty stereotyping, preposterous scenarios, and the most egregious and controlling relationships based upon fear and retribution. This movie grandstands this mucho behaviour and promotes it in the most barefaced manner. How can this still exist in 2024!

It does not pass the minimum bar of six out loud laughs per movie I didn't laugh once.

Lastly and perhaps most shockingly this movie was used as a vehicle for the cancelled actor Will Smith to re-enter Hollywood. Previously he presented himself as a black role model across the world, a whole generation copied his supposed wholesome and non-judgemental approach, he then turned out to be nothing more that a violent misogynistic who had hoodwinked the public for years, there is no coming back from that period!

I hated this reductive movie from start to finish I'm not sure who this was made for but whoever is lapping up this rubbish needs to take take a close look at what it is they are admiring.

For me this is a 3 outta 10, at best, I enjoyed some of the stunts.","June 7, 2024 (United States)"
20,10.0,10 June 2024,"Martin Lawrence totally killed it here but I do believe Will Smith is still affected in his acting due to his slap incident (or perhaps his charm is gone).

Same old story (good guys get set-up by bad guys and they win in the end). Jokes were ok but I don't think I want to see Will Smith ever again on the screen (he was once a favorite actor of mine).

Supporting cast was lackluster as most people have said. And some scenes were fun but the story overall was very predictable (specially who the bad guy is which you can figure it out in the first 20 minutes or so).

I love action films and comedy, this used to be a great movie series but I think Will Smith should consider retiring and let his glory days be gone...","June 7, 2024 (United States)"
