,Rating,Review_Date,Review,Release_Date
86,9.0,7 June 2024,"Finally an AWESOME summer film!!!

No Spoilers:

I've always enjoyed the comedic styles of Martin Laurence and Will Smith going back to the late 80's.

The chemistry between the two has always been great and they still have it in this fourth entry of the series. This might have been my favorite role Matin has ever played. In fact, he makes the movie.

The plot kept my interest and there are some fun callbacks spread around the film. Overall, the film was FUN! You have action, comedy, music and quality dialogue for once. Lots of laughter in our theatre and I look forward to going to see it again before it gets released at home.

Enjoy!","June 7, 2024 (United States)"
87,9.0,10 June 2024,"Despite the comedic misfires, Martin Lawrence manages to salvage some moments. His ability to wring humour out of even the most predictable jokes is commendable.

However, these moments aren't enough to salvage the film. Ride or Die never elevates itself beyond a mediocre action-comedy. It plays it safe, content to rehash old tropes rather than offering anything fresh or original.

Who Should See It?

Bad Boys: Ride or Die caters to a specific audience. If you're a devotee of the franchise with low expectations for plot or character development, this might provide a mindless summer escape. But for those seeking an intelligent, well-written, or emotionally engaging experience, look elsewhere. Ride or Die might rev the engine, but it ultimately sputters out, leaving viewers yearning for the inventive action and witty dialogue that defined the original Bad Boys.","June 7, 2024 (United States)"
88,1.0,9 June 2024,"To be honest I find it astonishing that they even made this.

How long ago was the first one? It feels like a lifetime ago.

While the first one was very exciting the sequel was not so great. That's where they should have stopped.

The third film was a surprise coming so long after the first two and, let's face it, was interminable. It literally goes on far too long.

I've never managed to sit through in its entirety. Not even on television.

Now we get this fourth film . Its amazing that they made and released it. Bad Boys is a thing of the past. I don't think that anyone was counting the days until another Bad Boys movie.

As for the movie itself: meh!! You've seen it all before. Over the top stupid action and unfunny ""comedy"" that doesn't land.

Don't waste your money seeing this on the big screen. I don't really advise seeing it at all.

I will always love the first Bad Boys movie.

Stop making rubbish sequels way too many years later.","June 7, 2024 (United States)"
89,6.0,8 June 2024,"This movie had me and the friends I was with laughing out loud right from the start and throughout. After seeing ""The Fall Guy"" we were primed to check out the stunts and they were amazing. The acting was great. Smith and Lawrence were quite funny and Jacob Scipio s a nice addition to the mix. Tiffany Haddish's role was absurdly amusing. The women were strong and the men were all over the place. The plot had innovative twists that made a big difference. We loved the alligator. The villains were very bad and the Bad Boys were hilarious. If you need pick me up, this movie will do quite fine. Check it outðŸ˜.","June 7, 2024 (United States)"
90,5.0,7 June 2024,"First and foremost, it's another great bad boys movie full of action and comedy, yes, yes, they getting old, but the movie stayed the same, full of action, full of comedy and general fun.

Loved the twists that kept on happening in the movie (rather predictable to someone who's watched a lot of movies) but nevertheless great experience.

Love the tiktok fellas cameo at a single scene, and thank you for an obvious nod to John Wick action at a certain scene by certain individual, wasn't expecting that, but it was great, and unexpected!

Overall I would definitely recommend this movie to every action/comedy lover, as this is just another banger that you must watch.","June 7, 2024 (United States)"
91,9.0,26 July 2024,"Loved the originals back in the day, but super disappointed with this one. Everything about it, from the script to the direction to the editing is so incredibly amateur, it's surprising Smith allowed it (there was a time I felt he managed to consistently output quite high caliber movies). The directors are clearly no Bay, and in fact a lot of the movie comes off as made-for-tv quality, with no scene really landing or immersing the viewer as it should. Not helped of course by a wafer thin plot, awful dialogue, and OTT acting throughout, especially by Lawrence (who simply wasn't funny here - overacting doesn't make unfunny material funny, so not totally his fault, he tried at least). It's all a classic case of style over substance, though even the style is woeful - in the same way that overacting doesn't make unfunny dialogue funnier, adding slow-mo to badly shot, over-CGI'd scenes also doesn't make them better scenes. The editing is frequently bad, confusing the action as well as jarring the viewing experience - I don't recall a film where the main components didn't gel quite as frequently as this one in several years. It's basically a string of 'comedic' scenes that don't land (at one point, a crocodile model lands next to Marcus during a shootout (not even with rednecks) and he yells 'Oh s**t, it's a Redneck Jurassic Park!' - like Jurassic Park was about crocodiles), and action scenes that so badly want to be stylish but fall flat (there was one particular shootout at an abandoned theme park that reminded me of the Waterworld show at Universal Studios, complete with exploding barrels on boats and bad guys collapsing through broken balconies when shot). I'd say don't waste your time, but I'm sure some people will still enjoy this movie as dumb summer fun. I can't help feel like they've wasted the potential of the concept. Another franchise that should have been left in the past, perhaps.","June 7, 2024 (United States)"
92,6.0,18 June 2024,"I need first to express here how much I hated ""Bad Boys for Life"". I really thought that it was a terrible, cheap, tired, rehash of old plots. I say this here because, against all odds, I quite liked ""Ride or Die"".

At Mike Lowrey's (Will Smith) wedding, his long-term partner and best friend Marcus Burnett (Martin Lawrence) suffers from a heart attack. During his recovery they learn that their mentor and former Captain, the late Conrad Howard (Joe Pantoliano) has been accused of bribery and corruption related to Cartel operations in Miami. Despite orders not to, unwilling to believe the evidence, they start to investigate, and this leads them back to Armando (Jacob Scipio) Mike's son, Howard's assassin, and former member of the cartel.

I'm not going to suggest for a moment that the film is great. Much of this again been done before and in better films. Martin Lawrence remains more tedious than funny and his ""I can't die"" schtick has been done elsewhere. Tiffany Haddish is surely being punished for something with this role, a one scene cameo that could not be more annoying. I hated the panic attack storyline, particularly as it's fixed with a ""man up"" moment. Also, if the villain twist in this movie comes as any form of surprise for you then. . . . would you like to buy these magic beans I have for sale?

I say all that, but again, I quite enjoyed the film. I liked most of the big action set piece at the end and the Reggie scene is great. I liked the return for Vanessa Hudgens and Alexander Ludwig and their interactions together. I just felt that, whilst not matching the ridiculous scale of ""Bad Boys 2"" this was a bigger and more interesting film than the last one. Do I need another one? I'd probably go, but equally the series has had a lot of repetition already, so I'm not bothered if not. Crossover with ""Fast and Furious"" though - yes please.","June 7, 2024 (United States)"
93,1.0,8 June 2024,"I was a fan of the funny, frenetic energy seen in Bad Boys I and II, but the ""funny"" has been missing in the last 2 movies, especially this one. There are a lot of attempts at humor that are completely funny and fall flat.

The action and story are fairly undercooked as well. The story is as predictable as an buddy-cop action thriller, and the action scenes are mostly gunplay sequences which you've seen in every other movie.

Thankfully, Will Smith and Martin Lawrence are good as usual and hold the movie together. It's very mindless and occasionally boring, but you may find some entertainment in the music and banter between the two leads.","June 7, 2024 (United States)"
94,10.0,8 June 2024,"With so much of social media spoiling movies and us having access to the movie before there is even a trailer, then Bad Boys For Life being not as great as it could've been I didn't have my hopes up high for this one but it didn't disappoint.

I loved the chemistry between Martin and Will and it's a testament of time from the 90s from when it all started. When it comes to these movies both stars get to shine together and never seems like one has to the dim their light for the other to get their shine on.

The character development over the years has been great to watch from the supporting cast, even though the original wife of Marcus Burnett didn't return, it didn't take away the supporting cast roles in the small parts that they shared on screen together.

Overall it was entertaining and is a must watch as it gets the summer blockbuster season started!!!","June 7, 2024 (United States)"
95,10.0,29 July 2024,"Yeah , i can confirme that it was a nice movie and all the events also the story, but the acting and action is like TOO MUCH, you can't feel the movie , the directore make you fill watching a movie of teens not a movie with real action.

Yeah , i can confirme that it was a nice movie and all the events also the story, but the acting and action is like TOO MUCH, you can't feel the movie , the directore make you fill watching a movie of teens not a movie with real action.

Yeah , i can confirme that it was a nice movie and all the events also the story, but the acting and action is like TOO MUCH, you can't feel the movie , the directore make you fill watching a movie of teens not a movie with real action.","June 7, 2024 (United States)"
96,8.0,22 June 2024,"This is another instance of that old saying about Hollywood: It's a place where a thousand people run to the place where lightning struck hoping that it'll strike again.

Bad Boys: Ride or Die is a boring retread of a tired story that wasn't interesting the first time, but somehow the filmmakers thought, ""Let's try something completely new! We'll do the same thing we did all those other times but THIS time we'll have the characters make references to how they're really, really old. You know, cuz that's what all the young movie goers think is really funny.""

Acting-wise, you'd think by now Will Smith would try to change it up a little and not try to be the same character in a different role. Because I'm telling you that 1990s shtick he's been doing for the last 40 years is sooooo played out.

I couldn't make it all the way through, because it's just the same junk, different day.

You'll go watch it because nostalgia and you desperately want to give one of the stars a second chance at being relevant, and I kinda get that. When my uncle Colin got out of H Block my mom let him stay with us, but that didn't work out and neither did this film. It's just not worth the boredom.

You watch this and you'll wish you had taken my advice, and I'll say I told you so. Not that I'm one to say that, but, truthfully I did tell you.","June 7, 2024 (United States)"
97,4.0,9 June 2024,"This movie was a great addition to the franchise. It was filled with more action than comedy, but it was still a hit. I appreciate how they connected all of the previous movies & allowed most of the original cast to appear.

Ignore all of the negative reviews. They came from individuals who haven't even seen the movie. All they are going by is the infamous crap that happened at the Oscars. None of that has anything to do with this movie.

If you want an action-packed adventure, a feeling of nostalgia & a sprinkle of comedic relief, this is your movie. This is quite arguably one of the greatest movies of the summer/year.","June 7, 2024 (United States)"
98,7.0,9 June 2024,"Fantastic movie, action pack, Reggie is the standout in this film. Not as good as 2 but it's a very close second. I will be going back again. Super funny. Great movie. McSteamy is still fine as ever and is getting finer with age. This movie was so action packed and insanely funny. I was yelling at the screen the whole time. I saw Bad Boys 2 in the movie theaters thirteen times and I think I will be going to see this one about the same many times because it was so good. Will Smith is fine and so is that darn son (in the movie). It wasn't really that predictable like some movies. Do yourself a favor and go see it.","June 7, 2024 (United States)"
99,3.0,6 June 2024,"It's all in the family - someone took Fast & Furious notes. So no pun intended - if anything the Bad Boys have to apologize. But let's keep it ""real"" . This is a movie, this is insane, this does not make much sense. It will either be carried by the charm (or lack thereof) from our main characters or it won't.

Martin Lawrence is being annoying - always nagging away ... but is he? Because there is an inciting incident, that kind of changes his demeanor. Will Smith has his own issues of course - and we still are dealing with the backlash from the third movie (and I still feel they missed a great chance - naming the third part 4 life? I mean come ... they could have called it ride or die and held on to the 4 ... 4 here).

Good action sequences, even the ones with the Uwe Boll technique (as some are saying online - they may look weird as behind the scenes looks ... but they do work in the movie - very well edited and all that). The question is are you ready to shut off your brain and enjoy this for what it is ... many things do not make sense otherwise. Like not taking one individual who proved to be quite useful to the ... well last mission/ending of the movie.

Maybe in a different universe, there are better plotlines ... but we do live here ... so let's make do with what we get ... and not overthink it. Good soundtrack, almost makes you forget about the cliches.","June 7, 2024 (United States)"
100,9.0,13 June 2024,"It's been a long time since I've been this distracted by directing/cinematography this try-hard and obnoxious. Every single frame of this movie reeks of desperation and insecurity in the written material. If you thought ""The Gray Man"" had the most distracting use of drone shots ever, be prepared for it to be blown out of the water by Bad Boys 4. Every shot was a new attempt at a different camera style or tracking shot. It was like watching a 2 hour music video. Good directors know when to let a scene breathe. We're not dealing with good directors here. Competent? Absolutely. Good? Nope.

All the performances are pretty bad except for Martin Lawrence, whose character is now relegated to just straight up being a clown, accentuated constantly by the directors' aggressively unpleasant use of extreme close ups. The dramatic bonding moments before the climactic action scene was shot like a comedy scene. But it was meant to be heartwarming. That being said, he plays a good clown, and Lawrence is the only actor who seems to actually be able to let go of his ego.

Will Smith isn't at all believable in this role anymore, he just isn't a good enough actor to convince you he's anything but a pampered movie star. It's funny how the writers have to make so many caveats and leaps to allow Joey Pants back into the franchise after his character's death in the last movie. The chief in the first movies was just a regular guy who was friends with the leads, but this movie retcons him to be this unflappable moral hero who is treated with so much reverence, Will Smith just HAS to have this large picture of a dead man at his wedding. Apparently Joey wasn't just some likeable schmuck, but he was actually an unrelenting super cop, that everyone saw as a messianic figure, who was killed because of his genius skills uncovering drug organisations. The Joey Pants from the first movies was the kind of guy who would throw his computer in a rage because he forgot how to log in, now he's a genius who knows how to send complex encrypted messages?

There are about a dozen moments of unrelenting cringe throughout. There are moments the filmmakers are thinking are either funny or dramatic but they just come off as phoney and pandering. All the ""bad ass"" moments are just embarrassing.

The whole plot and resolution is a foregone conclusion, you know exactly who the bad guy is gonna be revealed to be, and how the plot will resolve, within the first 20 minutes. They don't even have the guts to kill off useless side characters whose death could at least add a sense of consequence to the weightless action scenes.

In a staggering surprise, the musical score and needles drops were actually pretty good and often restrained. Most modern action flicks have dreadful and annoying music choices, but in this, it was the least egregious aspect of a pretty bad 2 hours.

The best part of this movie is the part where the villain is asked ""when did all this corruption start?"", and I swear to god his answer starts with ""well, after 9/11..."". They did an arrested development joke but totally sincerely. That's the most unaware thing I've seen a film do in years. Classic 10/10 moment, no notes.

One scene indicative of the lazy writing is when Vanessa Hudgens looks at an art piece, sees a QR code and says ""that's strange"" and lo and behold, the QR code is crucial to the plot and leads the to another message from the omniscient dead Captain . But QR codes are crazy-common in art exhibits, posters and adverts, just by some miracle she assumed the QR code had to do with the case? This is equivalent to a detective movie, where the lead cop sees a chewing gum wrapper on the street, says ""boy that's strange"", proceeds to pick it up, and sees it has crucial details of the murder suspect written on it. That's how contrived this writing is. Oh, and the first 10 minutes is just non-stop of the worst exposition dialogue you've heard in the last decade.

The forced ambiguous dialogue leading up to this point is excruciating too . Also, why is this huge art night club gig happening in the middle of the day? It's also funny that there are a tonne of returning characters from the previous film that no one cares about, but the directors think you do. I saw this movie with someone who loves the Bad Boys movies, and he didn't know who most of the returning characters were.

The worst parts of this movie are when it tried to be heartfelt and dramatic. I felt sick and angry that these filmmakers were trying to manipulate my emotions with the subtlety and nuance of a bad 13 Reasons Why episode.

Marcus FaceTimes with his wife in this movie, and it's a huge pet peeve of mine when a simple image of someone over FaceTime looks like it was shot with an 8k, million dollar camera. Just use the real phone to make the call! It'll take way less time and look so much better, and it won't take us out of the movie! Steven Soderbergh's 'Kimi' did this. Why spend more many to make your movie worse? But I guess that these directors in a nutshell.

Theres also a subplot where Marcus is enlightened after a near death experience, but it changes from scene to scene. Sometimes he won't care about anything, and the next, he's right back to his neurotic self, and he just swings back and forth. Also, amazing that in 2024, there's still a movie so dumb that someone having a panic attack is fixed by someone slapping you and telling you to man up. Legendary stuff right there.

So yeh, not a great movie, occasionally fun and wild, but mostly overlong and annoying. Martin Lawrence and the music was good, the direction could have been good if they had any restraint, and Will Smith and the plot are total flat lines. Oh yeh, and the product placement is crazy. Little hint, if the movie has a bunch of Skittle product placement (ala Shazam 2), then it's probably a bad film.","June 7, 2024 (United States)"
101,3.0,8 June 2024,"Always excited to see a Simpson Bruckheimer film! I'm a huge Will Smith fan and love the bad boys series. I absolutely loved the nod backs to the original...especially the classic pose from when Julie was kidnapped. Also loved the fact that the original mark mancina score made its way back. Action was great with outstanding special effects.

While I expected some of Will's usual subtle humor, I was let down as it didn't appear to be as many of his ad libs as I usually see in a Will Smith film.

While I don't feel it was as great as the first two, it was still action packed and entertaining.

Wasn't happy with the casing of Theresa, she just couldn't fill the shoes of Theresa Randle. Eric Dane played a fantastic villain, but I found it hard to really get into his character because he is McSteamy afterall and ""saves lives""!

Still disappointed that my favorite phrase of all time ""Woosah"" still hasn't made its way back into a sequel.

Pay close attention and you'll catch a couple fun cameos in the flick!","June 7, 2024 (United States)"
102,3.0,26 July 2024,"BAD BOYS: RIDE OR DIE is the latest in the long-running screen franchise which essentially refigures the LETHAL WEAPON films for black audiences. I was really disappointed by the quality of this one; as a film it's all over the place and a real drop in standards given that the last one (BAD BOYS FOR LIFE) was my favourite so far. But no. Here we get a hastily scribbled together plot with generic villains and actors wasted in predictable roles (Ioan Gruffudd, I'm looking at you). Even worse, the humour doesn't hit the mark anymore. Smith does very little and Lawrence is required to pull silly faces and do nothing else. I can't really think of anything positive to say...","June 7, 2024 (United States)"
103,1.0,9 June 2024,Anyone that knows me know I am not easily impressed with movies... Most movies ppl think is ðŸ”¥ I think it's ðŸš®... This one did not disappoint!!! I was thoroughly entertained from beginning to end!!! I was so happy to see Martin doing good and Will Smith still very much giving Mike Looooowery ðŸ˜‚ðŸ˜‚ðŸ˜‚ Loved the Reggie scene!!! It was action packed and gave a suspense factor!!! I was surprised that I was laughing quite often because I swear It's hard to make me laugh in a move these days. Overall it was phenomenal! I only gave a 9 because no movie is perfect!!! Sooo happy it came out on my Birthday!!! ðŸŽ‰ Bad Boys For Life!!!!,"June 7, 2024 (United States)"
104,7.0,29 July 2024,"Overall, ""Bad Boys: Ride or Die"" was a disappointment. Watching old men's antics for trivial reasons felt ridiculous. Yes, Will Smith is still in good shape, but everyone knows how old he is, and he is certainly no Tom Cruise.

While there were moments where the jokes hit the mark, they weren't enough to salvage a shallow and boring storyline. The film seems to have forgotten that it's 2024, not 1995 like the original installment. The plot feels outdated and fails to resonate with today's audience.

On a positive note, I appreciated the absence of any forced agendas in the movie. However, this alone couldn't make up for the overall lackluster experience. ""Bad Boys: Ride or Die"" failed to live up to the legacy of its predecessors and left me longing for the charm and wit of the earlier films.","June 7, 2024 (United States)"
105,10.0,23 July 2024,"Bad Boys franchise followed me from my teen years all the way to now, decades later. I've noticed something recentley, as I age myself, that actors, as they get older, lose a lot of that charisma or that ""ja nes sais quoi"" they had when they were young and fearless. Their acting skills deminish, their sense of self-evaluation, or at least evaluting their work, becomes blurred. Myopia, or loss of ability to be critical of oneself becomes an issue for us all one day... I think anyway. This movie, just as much as the 3rd one, shines a light on that fact. Acting has gotten pretty bad, and Martin Lawrence was hard to watch. What happened to his head, btw? Storyline, and movie action sequences, are all seen before and things turn from bad to worse in a hurry. All kinds of cliches are put on rinse and repeat, while the good ole racism jokes capture our attention once more. Overall, a B grade movie with a big budget and big expectations that falls flat on its tummy. Hope they stop the franchise now and stop embarassing themselves. Moving on from this cereal box movie concept would be a great idea, especially for Will.","June 7, 2024 (United States)"
